564086,,POSTAGE,1.0,8/23/11 9:36,160.0,
564087,22503,CABIN BAG VINTAGE PAISLEY,4.0,8/23/11 9:38,29.95,
564087,22504,CABIN BAG VINTAGE RETROSPOT,4.0,8/23/11 9:38,29.95,
564087,21788,KIDS RAIN MAC BLUE,24.0,8/23/11 9:38,0.85,
564087,21789,KIDS RAIN MAC PINK,24.0,8/23/11 9:38,0.85,
564087,20749,ASSORTED COLOUR MINI CASES,6.0,8/23/11 9:38,7.95,
564087,20682,RED RETROSPOT CHILDRENS UMBRELLA,6.0,8/23/11 9:38,3.25,
564087,20961,STRAWBERRY BATH SPONGE,20.0,8/23/11 9:38,1.25,
564087,20963,APPLE BATH SPONGE,30.0,8/23/11 9:38,1.25,
564087,21485,RETROSPOT HEART HOT WATER BOTTLE,6.0,8/23/11 9:38,4.95,
564087,22580,ADVENT CALENDAR GINGHAM SACK,9.0,8/23/11 9:38,5.95,
564087,22452,MEASURING TAPE BABUSHKA PINK,12.0,8/23/11 9:38,2.95,
564087,22453,MEASURING TAPE BABUSHKA BLUE,18.0,8/23/11 9:38,2.95,
564087,22326,ROUND SNACK BOXES SET OF4 WOODLAND,48.0,8/23/11 9:38,2.55,
564087,22327,ROUND SNACK BOXES SET OF 4 SKULLS,48.0,8/23/11 9:38,2.55,
564087,21216,"SET 3 RETROSPOT TEA,COFFEE,SUGAR",8.0,8/23/11 9:38,4.95,
564087,23243,SET OF TEA COFFEE SUGAR TINS PANTRY,8.0,8/23/11 9:38,4.95,
564087,21218,RED SPOTTY BISCUIT TIN,6.0,8/23/11 9:38,3.75,
564087,21154,RED RETROSPOT OVEN GLOVE,10.0,8/23/11 9:38,1.25,
564087,21906,PHARMACIE FIRST AID TIN,8.0,8/23/11 9:38,6.75,
564087,23245,SET OF 3 REGENCY CAKE TINS,12.0,8/23/11 9:38,4.95,
564087,22348,TEA BAG PLATE RED RETROSPOT,12.0,8/23/11 9:38,0.85,
564087,22195,LARGE HEART MEASURING SPOONS,12.0,8/23/11 9:38,1.65,
564087,23050,RECYCLED ACAPULCO MAT GREEN,8.0,8/23/11 9:38,8.25,
564087,23052,RECYCLED ACAPULCO MAT TURQUOISE,8.0,8/23/11 9:38,8.25,
564087,23053,RECYCLED ACAPULCO MAT PINK,8.0,8/23/11 9:38,8.25,
564087,23054,RECYCLED ACAPULCO MAT LAVENDER,8.0,8/23/11 9:38,8.25,
564087,21936,RED RETROSPOT PICNIC BAG,5.0,8/23/11 9:38,2.95,
564087,20674,GREEN POLKADOT BOWL,16.0,8/23/11 9:38,1.25,
564087,20676,RED RETROSPOT BOWL,16.0,8/23/11 9:38,1.25,
564087,20675,BLUE POLKADOT BOWL,16.0,8/23/11 9:38,1.25,
564087,20677,PINK POLKADOT BOWL,16.0,8/23/11 9:38,1.25,
564087,21843,RED RETROSPOT CAKE STAND,5.0,8/23/11 9:38,10.95,
564087,,CHILDRENS CUTLERY RETROSPOT RED,48.0,8/23/11 9:38,4.15,
564087,,CHILDRENS CUTLERY POLKADOT PINK,48.0,8/23/11 9:38,4.15,
564087,23256,CHILDRENS CUTLERY SPACEBOY,24.0,8/23/11 9:38,4.15,
564087,,CHILDRENS CUTLERY POLKADOT BLUE,24.0,8/23/11 9:38,4.15,
564087,23255,CHILDRENS CUTLERY CIRCUS PARADE,24.0,8/23/11 9:38,4.15,
564087,22634,CHILDS BREAKFAST SET SPACEBOY,6.0,8/23/11 9:38,9.95,
564087,22635,CHILDS BREAKFAST SET DOLLY GIRL,6.0,8/23/11 9:38,9.95,
564087,22636,CHILDS BREAKFAST SET CIRCUS PARADE,6.0,8/23/11 9:38,8.5,
564087,22423,REGENCY CAKESTAND 3 TIER,6.0,8/23/11 9:38,12.75,
564087,20979,36 PENCILS TUBE RED RETROSPOT,16.0,8/23/11 9:38,1.25,
564087,20977,36 PENCILS TUBE WOODLAND,16.0,8/23/11 9:38,1.25,
564087,20981,12 PENCILS TALL TUBE WOODLAND,12.0,8/23/11 9:38,0.85,
564087,20978,36 PENCILS TUBE SKULLS,16.0,8/23/11 9:38,1.25,
564087,20982,12 PENCILS TALL TUBE SKULLS,12.0,8/23/11 9:38,0.85,
564087,22139,RETROSPOT TEA SET CERAMIC 11 PC,24.0,8/23/11 9:38,4.25,
564087,22138,BAKING SET 9 PIECE RETROSPOT,6.0,8/23/11 9:38,4.95,
,,Manual,-1.0,9/19/11 16:13,2653.95,
567353,,Manual,1.0,9/19/11 16:14,2653.95,
,21843,RED RETROSPOT CAKE STAND,-1.0,10/4/11 13:43,10.95,
571652,23076,ICE CREAM SUNDAE LIP GLOSS,24.0,10/18/11 12:17,1.25,
571652,22969,HOMEMADE JAM SCENTED CANDLES,12.0,10/18/11 12:17,1.45,
571652,23391,I LOVE LONDON MINI BACKPACK,4.0,10/18/11 12:17,4.15,
571652,47421,ASSORTED COLOUR LIZARD SUCTION HOOK,24.0,10/18/11 12:17,0.42,
571652,37495,FAIRY CAKE BIRTHDAY CANDLE SET,4.0,10/18/11 12:17,3.75,
571652,72741,GRAND CHOCOLATECANDLE,9.0,10/18/11 12:17,1.45,
571652,22716,CARD CIRCUS PARADE,12.0,10/18/11 12:17,0.42,
571652,22580,ADVENT CALENDAR GINGHAM SACK,3.0,10/18/11 12:17,5.95,
571652,22947,WOODEN ADVENT CALENDAR RED,2.0,10/18/11 12:17,16.95,
571652,21731,RED TOADSTOOL LED NIGHT LIGHT,12.0,10/18/11 12:17,1.65,
571652,22779,WOODEN OWLS LIGHT GARLAND,4.0,10/18/11 12:17,4.25,
571652,21744,SNOWFLAKE PORTABLE TABLE LIGHT,6.0,10/18/11 12:17,2.95,
571652,22780,LIGHT GARLAND BUTTERFILES PINK,4.0,10/18/11 12:17,4.25,
571652,,GREEN BITTY LIGHT CHAIN,3.0,10/18/11 12:17,1.25,
571652,21829,DINOSAUR KEYRINGS ASSORTED,36.0,10/18/11 12:17,0.21,
571652,20819,SILVER TEDDY BEAR,4.0,10/18/11 12:17,3.75,
571652,21055,TOOL BOX SOFT TOY,1.0,10/18/11 12:17,8.95,
571652,22138,BAKING SET 9 PIECE RETROSPOT,3.0,10/18/11 12:17,4.95,
571652,22139,RETROSPOT TEA SET CERAMIC 11 PC,3.0,10/18/11 12:17,4.95,
571652,23348,CHILDRENS TOY COOKING UTENSIL SET,6.0,10/18/11 12:17,2.08,
571652,21915,RED  HARMONICA IN BOX,12.0,10/18/11 12:17,1.25,
571652,22550,HOLIDAY FUN LUDO,4.0,10/18/11 12:17,3.75,
571652,21912,VINTAGE SNAKES & LADDERS,4.0,10/18/11 12:17,3.75,
571652,22622,BOX OF VINTAGE ALPHABET BLOCKS,2.0,10/18/11 12:17,11.95,
571652,22433,WATERING CAN GREEN DINOSAUR,6.0,10/18/11 12:17,1.95,
571652,23155,KNICKERBOCKERGLORY MAGNET ASSORTED,12.0,10/18/11 12:17,0.83,
571652,23077,DOUGHNUT LIP GLOSS,20.0,10/18/11 12:17,1.25,
573154,22139,RETROSPOT TEA SET CERAMIC 11 PC,12.0,10/28/11 8:20,4.95,
573154,21915,RED  HARMONICA IN BOX,24.0,10/28/11 8:20,1.25,
573154,22620,4 TRADITIONAL SPINNING TOPS,24.0,10/28/11 8:20,1.45,
573154,22619,SET OF 6 SOLDIER SKITTLES,12.0,10/28/11 8:20,3.75,
573154,22452,MEASURING TAPE BABUSHKA PINK,30.0,10/28/11 8:20,2.95,
573154,22492,MINI PAINT SET VINTAGE,36.0,10/28/11 8:20,0.65,
573154,23328,SET 6 SCHOOL MILK BOTTLES IN CRATE,8.0,10/28/11 8:20,3.75,
,,Manual,-1.0,11/14/11 13:26,326.1,
576234,,Manual,1.0,11/14/11 13:27,326.1,
