563613,20717,STRAWBERRY SHOPPER BAG,60.0,8/18/11 8:49,1.25,12688
563613,20718,RED RETROSPOT SHOPPER BAG,60.0,8/18/11 8:49,1.25,12688
563613,20712,JUMBO BAG WOODLAND ANIMALS,10.0,8/18/11 8:49,2.08,12688
563613,22377,BOTTLE BAG RETROSPOT,10.0,8/18/11 8:49,2.1,12688
563613,23199,JUMBO BAG APPLES,10.0,8/18/11 8:49,2.08,12688
563613,22386,JUMBO BAG PINK POLKADOT,10.0,8/18/11 8:49,2.08,12688
563613,23200,JUMBO BAG PEARS,10.0,8/18/11 8:49,2.08,12688
563613,22411,JUMBO SHOPPER VINTAGE RED PAISLEY,10.0,8/18/11 8:49,2.08,12688
563613,20719,WOODLAND CHARLOTTE BAG,100.0,8/18/11 8:49,0.72,12688
563613,20723,STRAWBERRY CHARLOTTE BAG,10.0,8/18/11 8:49,0.85,12688
563613,20724,RED RETROSPOT CHARLOTTE BAG,100.0,8/18/11 8:49,0.72,12688
563613,20749,ASSORTED COLOUR MINI CASES,12.0,8/18/11 8:49,6.35,12688
563613,21000,ROSE DU SUD COSMETICS BAG,6.0,8/18/11 8:49,4.25,12688
563613,21001,ROSE DU SUD WASHBAG,3.0,8/18/11 8:49,5.95,12688
563613,,GREEN ROSE WASHBAG,4.0,8/18/11 8:49,3.75,12688
563613,,PINK ROSE WASHBAG,4.0,8/18/11 8:49,3.75,12688
563613,,HELLO SAILOR BLUE SOAP HOLDER,12.0,8/18/11 8:49,1.69,12688
563613,22171,3 HOOK PHOTO SHELF ANTIQUE WHITE,2.0,8/18/11 8:49,8.5,12688
563613,22762,CUPBOARD 3 DRAWER MA CAMPAGNE,8.0,8/18/11 8:49,12.75,12688
563613,23112,PARISIENNE CURIO CABINET,2.0,8/18/11 8:49,7.5,12688
563613,22485,SET OF 2 WOODEN MARKET CRATES,4.0,8/18/11 8:49,12.75,12688
563613,22824,3 TIER SWEETHEART GARDEN SHELF,1.0,8/18/11 8:49,35.95,12688
563613,22487,WHITE WOOD GARDEN PLANT LADDER,1.0,8/18/11 8:49,9.95,12688
563613,22961,JAM MAKING SET PRINTED,12.0,8/18/11 8:49,1.45,12688
563613,22960,JAM MAKING SET WITH JARS,12.0,8/18/11 8:49,3.75,12688
563613,22077,6 RIBBONS RUSTIC CHARM,12.0,8/18/11 8:49,1.65,12688
563613,21279,VINTAGE KITCHEN PRINT FRUITS,6.0,8/18/11 8:49,2.55,12688
563613,21280,VINTAGE KITCHEN PRINT VEGETABLES,6.0,8/18/11 8:49,2.55,12688
563613,21249,WOODLAND  HEIGHT CHART STICKERS,30.0,8/18/11 8:49,2.55,12688
563613,,"METAL SIGN,CUPCAKE SINGLE HOOK",8.0,8/18/11 8:49,1.25,12688
563613,,"METAL SIGN,CUPCAKE SINGLE HOOK",8.0,8/18/11 8:49,1.25,12688
563613,,METAL SIGN CUPCAKE SINGLE HOOK,8.0,8/18/11 8:49,1.25,12688
563613,22083,PAPER CHAIN KIT RETROSPOT,36.0,8/18/11 8:49,2.95,12688
563613,22204,MILK PAN BLUE POLKADOT,4.0,8/18/11 8:49,3.75,12688
563613,22203,MILK PAN RED RETROSPOT,4.0,8/18/11 8:49,3.75,12688
563613,21035,SET/2 RED RETROSPOT TEA TOWELS,6.0,8/18/11 8:49,3.25,12688
563613,22989,SET 2 PANTRY DESIGN TEA TOWELS,6.0,8/18/11 8:49,3.25,12688
563613,22200,FRYING PAN PINK POLKADOT,4.0,8/18/11 8:49,4.25,12688
563613,22201,FRYING PAN BLUE POLKADOT,4.0,8/18/11 8:49,4.25,12688
563613,22378,WALL TIDY RETROSPOT,5.0,8/18/11 8:49,2.1,12688
563613,22832,BROCANTE SHELF WITH HOOKS,2.0,8/18/11 8:49,10.75,12688
563613,21212,PACK OF 72 RETROSPOT CAKE CASES,24.0,8/18/11 8:49,0.55,12688
563613,21975,PACK OF 60 DINOSAUR CAKE CASES,24.0,8/18/11 8:49,0.55,12688
563613,22417,PACK OF 60 SPACEBOY CAKE CASES,24.0,8/18/11 8:49,0.55,12688
563613,22951,60 CAKE CASES DOLLY GIRL DESIGN,24.0,8/18/11 8:49,0.55,12688
563613,21976,PACK OF 60 MUSHROOM CAKE CASES,24.0,8/18/11 8:49,0.55,12688
563613,21977,PACK OF 60 PINK PAISLEY CAKE CASES,24.0,8/18/11 8:49,0.55,12688
563613,22848,BREAD BIN DINER STYLE PINK,1.0,8/18/11 8:49,16.95,12688
563613,22627,MINT KITCHEN SCALES,4.0,8/18/11 8:49,8.5,12688
563613,22625,RED KITCHEN SCALES,4.0,8/18/11 8:49,8.5,12688
563613,22567,20 DOLLY PEGS RETROSPOT,12.0,8/18/11 8:49,1.45,12688
563613,23245,SET OF 3 REGENCY CAKE TINS,12.0,8/18/11 8:49,4.95,12688
563613,22326,ROUND SNACK BOXES SET OF4 WOODLAND,48.0,8/18/11 8:49,2.55,12688
563613,22328,ROUND SNACK BOXES SET OF 4 FRUITS,12.0,8/18/11 8:49,2.95,12688
563613,22628,PICNIC BOXES SET OF 3 RETROSPOT,12.0,8/18/11 8:49,4.95,12688
563613,22329,ROUND CONTAINER SET OF 5 RETROSPOT,12.0,8/18/11 8:49,1.65,12688
563613,22629,SPACEBOY LUNCH BOX,12.0,8/18/11 8:49,1.95,12688
563613,22630,DOLLY GIRL LUNCH BOX,12.0,8/18/11 8:49,1.95,12688
563613,22631,CIRCUS PARADE LUNCH BOX,12.0,8/18/11 8:49,1.95,12688
563613,23166,MEDIUM CERAMIC TOP STORAGE JAR,12.0,8/18/11 8:49,1.25,12688
563613,23167,SMALL CERAMIC TOP STORAGE JAR,12.0,8/18/11 8:49,0.83,12688
563613,23174,REGENCY SUGAR BOWL GREEN,4.0,8/18/11 8:49,4.15,12688
563613,22343,PARTY PIZZA DISH RED RETROSPOT,12.0,8/18/11 8:49,0.85,12688
563613,22345,PARTY PIZZA DISH BLUE POLKADOT,24.0,8/18/11 8:49,0.85,12688
563613,22346,PARTY PIZZA DISH GREEN POLKADOT,24.0,8/18/11 8:49,0.85,12688
563613,22344,PARTY PIZZA DISH PINK POLKADOT,24.0,8/18/11 8:49,0.85,12688
563613,22423,REGENCY CAKESTAND 3 TIER,2.0,8/18/11 8:49,12.75,12688
563613,21242,RED RETROSPOT PLATE,24.0,8/18/11 8:49,1.69,12688
563613,21244,BLUE POLKADOT PLATE,24.0,8/18/11 8:49,1.69,12688
563613,21245,GREEN POLKADOT PLATE,24.0,8/18/11 8:49,1.69,12688
563613,21243,PINK  POLKADOT PLATE,24.0,8/18/11 8:49,1.69,12688
563613,21238,RED RETROSPOT CUP,16.0,8/18/11 8:49,0.85,12688
563613,23285,PINK VINTAGE SPOT BEAKER,16.0,8/18/11 8:49,0.85,12688
563613,21239,PINK  POLKADOT CUP,24.0,8/18/11 8:49,0.85,12688
563613,23286,BLUE VINTAGE SPOT BEAKER,24.0,8/18/11 8:49,0.85,12688
563613,21240,BLUE POLKADOT CUP,24.0,8/18/11 8:49,0.85,12688
563613,23287,RED VINTAGE SPOT BEAKER,24.0,8/18/11 8:49,0.85,12688
563613,23288,GREEN VINTAGE SPOT BEAKER,24.0,8/18/11 8:49,0.85,12688
563613,20674,GREEN POLKADOT BOWL,24.0,8/18/11 8:49,1.25,12688
563613,20676,RED RETROSPOT BOWL,24.0,8/18/11 8:49,1.25,12688
563613,21246,RED RETROSPOT BIG BOWL,24.0,8/18/11 8:49,4.25,12688
563613,20675,BLUE POLKADOT BOWL,24.0,8/18/11 8:49,1.25,12688
563613,20677,PINK POLKADOT BOWL,24.0,8/18/11 8:49,1.25,12688
563613,22197,POPCORN HOLDER,24.0,8/18/11 8:49,0.85,12688
563613,22635,CHILDS BREAKFAST SET DOLLY GIRL,4.0,8/18/11 8:49,9.95,12688
563613,22699,ROSES REGENCY TEACUP AND SAUCER,24.0,8/18/11 8:49,2.55,12688
563613,22697,GREEN REGENCY TEACUP AND SAUCER,24.0,8/18/11 8:49,2.55,12688
563613,23173,REGENCY TEAPOT ROSES,4.0,8/18/11 8:49,9.95,12688
563613,,CHERRY BLOSSOM  DECORATIVE FLASK,8.0,8/18/11 8:49,3.75,12688
563613,21078,SET/20 STRAWBERRY PAPER NAPKINS,12.0,8/18/11 8:49,0.85,12688
563613,21080,SET/20 RED RETROSPOT PAPER NAPKINS,12.0,8/18/11 8:49,0.85,12688
563613,23052,RECYCLED ACAPULCO MAT TURQUOISE,4.0,8/18/11 8:49,8.25,12688
563613,23050,RECYCLED ACAPULCO MAT GREEN,4.0,8/18/11 8:49,8.25,12688
563613,23053,RECYCLED ACAPULCO MAT PINK,4.0,8/18/11 8:49,8.25,12688
563613,21933,PINK VINTAGE PAISLEY PICNIC BAG,20.0,8/18/11 8:49,1.65,12688
563613,,ENVELOPE 50 BLOSSOM IMAGES,12.0,8/18/11 8:49,0.42,12688
563613,,BLOSSOM  IMAGES NOTEBOOK SET,24.0,8/18/11 8:49,1.25,12688
563613,23236,DOILEY STORAGE TIN,12.0,8/18/11 8:49,2.89,12688
563613,23240,SET OF 4 KNICK KNACK TINS DOILEY,12.0,8/18/11 8:49,4.15,12688
563613,21715,GIRLS VINTAGE TIN SEASIDE BUCKET,8.0,8/18/11 8:49,2.55,12688
563613,21716,BOYS VINTAGE TIN SEASIDE BUCKET,8.0,8/18/11 8:49,2.55,12688
563613,22139,RETROSPOT TEA SET CERAMIC 11 PC,6.0,8/18/11 8:49,4.95,12688
563613,21791,VINTAGE HEADS AND TAILS CARD GAME,12.0,8/18/11 8:49,1.25,12688
563613,22622,BOX OF VINTAGE ALPHABET BLOCKS,2.0,8/18/11 8:49,11.95,12688
563613,22232,JIGSAW TOADSTOOLS 3 PIECE,32.0,8/18/11 8:49,0.59,12688
563613,,BLUE NEW BAROQUE CANDLESTICK CANDLE,24.0,8/18/11 8:49,0.85,12688
563613,,PINK NEW BAROQUECANDLESTICK CANDLE,24.0,8/18/11 8:49,0.85,12688
563613,10133,COLOURING PENCILS BROWN TUBE,20.0,8/18/11 8:49,0.42,12688
563613,16048,TEATIME ROUND PENCIL SHARPENER,24.0,8/18/11 8:49,0.12,12688
563613,16219,HOUSE SHAPE PENCIL SHARPENER,48.0,8/18/11 8:49,0.06,12688
563613,16008,SMALL FOLDING SCISSOR(POINTED EDGE),24.0,8/18/11 8:49,0.12,12688
563613,16054,POPART RECT PENCIL SHARPENER ASST,36.0,8/18/11 8:49,0.12,12688
563613,22608,PENS ASSORTED FUNKY JEWELED,36.0,8/18/11 8:49,0.19,12688
563613,22609,PENS ASSORTED SPACEBALL,36.0,8/18/11 8:49,0.19,12688
563613,22610,PENS ASSORTED FUNNY FACE,36.0,8/18/11 8:49,0.19,12688
563613,,ENGLISH ROSE SPIRIT LEVEL,60.0,8/18/11 8:49,0.79,12688
563613,,ASS FLORAL PRINT MULTI SCREWDRIVER,72.0,8/18/11 8:49,0.42,12688
563613,,ENGLISH ROSE GARDEN SECATEURS,24.0,8/18/11 8:49,0.79,12688
563613,85015,SET OF 12  VINTAGE POSTCARD SET,24.0,8/18/11 8:49,0.65,12688
563613,,ROMANTIC IMAGES GIFT WRAP SET,12.0,8/18/11 8:49,0.65,12688
563613,,BLOSSOM IMAGES GIFT WRAP SET,12.0,8/18/11 8:49,0.65,12688
563613,85212,MINI PAINTED GARDEN DECORATION,48.0,8/18/11 8:49,0.29,12688
563613,23170,REGENCY TEA PLATE ROSES,24.0,8/18/11 8:49,1.65,12688
563613,23171,REGENCY TEA PLATE GREEN,24.0,8/18/11 8:49,1.65,12688
563613,23172,REGENCY TEA PLATE PINK,24.0,8/18/11 8:49,1.65,12688
563613,22969,HOMEMADE JAM SCENTED CANDLES,24.0,8/18/11 8:49,1.45,12688
563613,23306,SET OF 36 DOILIES PANTRY DESIGN,24.0,8/18/11 8:49,1.45,12688
563613,23243,SET OF TEA COFFEE SUGAR TINS PANTRY,4.0,8/18/11 8:49,4.95,12688
563613,22180,RETROSPOT LAMP,2.0,8/18/11 8:49,9.95,12688
563613,23108,SET OF 10 LED DOLLY LIGHTS,2.0,8/18/11 8:49,6.25,12688
563613,22617,BAKING SET SPACEBOY DESIGN,6.0,8/18/11 8:49,4.95,12688
563613,22138,BAKING SET 9 PIECE RETROSPOT,6.0,8/18/11 8:49,4.95,12688
563613,22090,PAPER BUNTING RETROSPOT,6.0,8/18/11 8:49,2.95,12688
563613,21756,BATH BUILDING BLOCK WORD,3.0,8/18/11 8:49,5.95,12688
563613,21754,HOME BUILDING BLOCK WORD,3.0,8/18/11 8:49,5.95,12688
563613,21755,LOVE BUILDING BLOCK WORD,3.0,8/18/11 8:49,5.95,12688
563613,,PINK POLKADOT GARDEN PARASOL,4.0,8/18/11 8:49,7.95,12688
563613,,BLUE POLKADOT GARDEN PARASOL,4.0,8/18/11 8:49,7.95,12688
563613,23292,SPACEBOY CHILDRENS CUP,8.0,8/18/11 8:49,1.25,12688
563613,23291,DOLLY GIRL CHILDRENS CUP,8.0,8/18/11 8:49,1.25,12688
563613,23293,SET OF 12 FAIRY CAKE BAKING CASES,16.0,8/18/11 8:49,0.83,12688
563613,23295,SET OF 12 MINI LOAF BAKING CASES,8.0,8/18/11 8:49,0.83,12688
563613,23296,SET OF 6 TEA TIME BAKING CASES,16.0,8/18/11 8:49,1.25,12688
563613,23307,SET OF 60 PANTRY DESIGN CAKE CASES,24.0,8/18/11 8:49,0.55,12688
563613,23294,SET OF 6 SNACK LOAF BAKING CASES,8.0,8/18/11 8:49,0.83,12688
563613,23546,WRAP PAISLEY PARK,25.0,8/18/11 8:49,0.42,12688
563613,23345,DOLLY GIRL BEAKER,12.0,8/18/11 8:49,1.25,12688
563613,23347,I LOVE LONDON BEAKER,12.0,8/18/11 8:49,1.25,12688
563613,23346,SPACEBOY BEAKER,12.0,8/18/11 8:49,1.25,12688
563613,22929,SCHOOL DESK AND CHAIR,2.0,8/18/11 8:49,65.0,12688
563613,22823,CHEST NATURAL WOOD 20 DRAWERS,1.0,8/18/11 8:49,125.0,12688
563613,21669,BLUE STRIPE CERAMIC DRAWER KNOB,96.0,8/18/11 8:49,1.06,12688
563613,22728,ALARM CLOCK BAKELIKE PINK,4.0,8/18/11 8:49,3.75,12688
563613,21210,SET OF 72 RETROSPOT PAPER  DOILIES,12.0,8/18/11 8:49,1.45,12688
563613,23298,SPOTTY BUNTING,3.0,8/18/11 8:49,4.95,12688
563613,20914,SET/5 RED RETROSPOT LID GLASS BOWLS,6.0,8/18/11 8:49,2.95,12688
563613,23209,LUNCH BAG DOILEY PATTERN,10.0,8/18/11 8:49,1.65,12688
563613,23203,JUMBO BAG DOILEY PATTERNS,10.0,8/18/11 8:49,2.08,12688
563613,23231,WRAP DOILEY DESIGN,25.0,8/18/11 8:49,0.42,12688
563613,22986,WRAP GINGHAM ROSE,25.0,8/18/11 8:49,0.42,12688
563613,,WRAP ENGLISH ROSE,25.0,8/18/11 8:49,0.42,12688
563613,22708,WRAP DOLLY GIRL,25.0,8/18/11 8:49,0.42,12688
563613,21932,SCANDINAVIAN PAISLEY PICNIC BAG,10.0,8/18/11 8:49,1.65,12688
563613,22161,HEART DECORATION RUSTIC HANGING,24.0,8/18/11 8:49,0.19,12688
563613,22354,RETROSPOT PADDED SEAT CUSHION,30.0,8/18/11 8:49,3.39,12688
563613,21154,RED RETROSPOT OVEN GLOVE,10.0,8/18/11 8:49,1.25,12688
563613,22720,SET OF 3 CAKE TINS PANTRY DESIGN,3.0,8/18/11 8:49,4.95,12688
563613,22277,COSMETIC BAG VINTAGE ROSE PAISLEY,6.0,8/18/11 8:49,2.1,12688
563613,22331,WOODLAND PARTY BAG + STICKER SET,48.0,8/18/11 8:49,1.45,12688
563613,22333,RETROSPOT PARTY BAG + STICKER SET,48.0,8/18/11 8:49,1.45,12688
563613,21578,WOODLAND DESIGN  COTTON TOTE BAG,60.0,8/18/11 8:49,2.25,12688
566179,22505,MEMO BOARD COTTAGE DESIGN,3.0,9/9/11 12:42,4.95,
566179,21003,ROSE DU SUD CUSHION COVER,2.0,9/9/11 12:42,6.35,
566179,20997,ROSE DU SUD CUSHION COVER,2.0,9/9/11 12:42,4.95,
566179,21002,ROSE DU SUD DRAWSTRING BAG,2.0,9/9/11 12:42,4.25,
566179,20712,JUMBO BAG WOODLAND ANIMALS,4.0,9/9/11 12:42,2.08,
566179,22385,JUMBO BAG SPACEBOY DESIGN,3.0,9/9/11 12:42,2.08,
566179,22380,TOY TIDY SPACEBOY,3.0,9/9/11 12:42,2.1,
566179,84920,PINK FLOWER FABRIC PONY,3.0,9/9/11 12:42,3.75,
566179,,ENGLISH ROSE SCENTED HANGING FLOWER,6.0,9/9/11 12:42,0.75,
566179,23236,STORAGE TIN VINTAGE DOILY,2.0,9/9/11 12:42,2.89,
566179,23240,SET OF 4 KNICK KNACK TINS DOILY,4.0,9/9/11 12:42,4.15,
566179,23240,SET OF 4 KNICK KNACK TINS DOILY,1.0,9/9/11 12:42,4.15,
566179,22139,RETROSPOT TEA SET CERAMIC 11 PC,5.0,9/9/11 12:42,4.95,
566179,22276,WASH BAG VINTAGE ROSE PAISLEY,5.0,9/9/11 12:42,2.55,
566179,20719,WOODLAND CHARLOTTE BAG,10.0,9/9/11 12:42,0.85,
566179,22382,LUNCH BAG SPACEBOY DESIGN,3.0,9/9/11 12:42,1.65,
566179,22321,BIRD DECORATION RED RETROSPOT,23.0,9/9/11 12:42,0.85,
566179,23433,HANGING QUILTED PATCHWORK APPLES,36.0,9/9/11 12:42,0.83,
566179,22668,PINK BABY BUNTING,15.0,9/9/11 12:42,2.95,
566179,22270,HAPPY EASTER HANGING DECORATION,20.0,9/9/11 12:42,3.75,
566179,22153,ANGEL DECORATION STARS ON DRESS,48.0,9/9/11 12:42,0.42,
566179,22449,SILK PURSE BABUSHKA PINK,12.0,9/9/11 12:42,3.35,
566179,22557,PLASTERS IN TIN VINTAGE PAISLEY,3.0,9/9/11 12:42,1.65,
566179,22553,PLASTERS IN TIN SKULLS,2.0,9/9/11 12:42,1.65,
566179,22551,PLASTERS IN TIN SPACEBOY,2.0,9/9/11 12:42,1.65,
566179,22554,PLASTERS IN TIN WOODLAND ANIMALS,3.0,9/9/11 12:42,1.65,
566179,23103,JINGLE BELL HEART DECORATION,11.0,9/9/11 12:42,1.65,
569527,,BLUE POLKADOT GARDEN PARASOL,1.0,10/4/11 14:53,7.95,12512
569527,21034,REX CASH+CARRY JUMBO SHOPPER,1.0,10/4/11 14:53,0.95,12512
569527,22319,HAIRCLIPS FORTIES FABRIC ASSORTED,12.0,10/4/11 14:53,0.65,12512
569527,47566,PARTY BUNTING,1.0,10/4/11 14:53,4.95,12512
569527,21992,VINTAGE PAISLEY STATIONERY SET,1.0,10/4/11 14:53,1.25,12512
569527,90099,NECKLACE+BRACELET SET BLUE HIBISCUS,1.0,10/4/11 14:53,2.55,12512
569527,22270,HAPPY EASTER HANGING DECORATION,1.0,10/4/11 14:53,3.75,12512
569527,,WHITE HANGING HEART T-LIGHT HOLDER,1.0,10/4/11 14:53,2.95,12512
569527,23432,PRETTY HANGING QUILTED HEARTS,12.0,10/4/11 14:53,0.83,12512
569527,23431,NATURAL HANGING QUILTED HEARTS,12.0,10/4/11 14:53,0.83,12512
569527,23240,SET OF 4 KNICK KNACK TINS DOILY,1.0,10/4/11 14:53,4.15,12512
569527,22628,PICNIC BOXES SET OF 3 RETROSPOT,1.0,10/4/11 14:53,4.95,12512
569527,20914,SET/5 RED RETROSPOT LID GLASS BOWLS,1.0,10/4/11 14:53,2.95,12512
569527,,WHITE HANGING HEART T-LIGHT HOLDER,1.0,10/4/11 14:53,2.95,12512
569527,21671,RED SPOT CERAMIC DRAWER KNOB,1.0,10/4/11 14:53,1.45,12512
569527,21672,WHITE SPOT RED CERAMIC DRAWER KNOB,1.0,10/4/11 14:53,1.45,12512
569527,23028,DRAWER KNOB CRACKLE GLAZE BLUE,1.0,10/4/11 14:53,1.65,12512
569527,21380,WOODEN HAPPY BIRTHDAY GARLAND,2.0,10/4/11 14:53,2.95,12512
569527,22759,SET OF 3 NOTEBOOKS IN PARCEL,1.0,10/4/11 14:53,1.65,12512
569527,21992,VINTAGE PAISLEY STATIONERY SET,1.0,10/4/11 14:53,1.25,12512
569527,22759,SET OF 3 NOTEBOOKS IN PARCEL,1.0,10/4/11 14:53,1.65,12512
569527,,ENGLISH ROSE NOTEBOOK A7 SIZE,3.0,10/4/11 14:53,0.42,12512
569527,23502,PLAYING CARDS VINTAGE DOILY,2.0,10/4/11 14:53,1.25,12512
569527,22558,CLOTHES PEGS RETROSPOT PACK 24,1.0,10/4/11 14:53,1.65,12512
569527,22200,FRYING PAN PINK POLKADOT,1.0,10/4/11 14:53,4.25,12512
569527,22203,MILK PAN RED RETROSPOT,1.0,10/4/11 14:53,3.75,12512
569527,22201,FRYING PAN BLUE POLKADOT,1.0,10/4/11 14:53,4.25,12512
569527,22204,MILK PAN BLUE POLKADOT,1.0,10/4/11 14:53,3.75,12512
569527,21429,RED GINGHAM ROSE JEWELLERY BOX,1.0,10/4/11 14:53,1.95,12512
569527,82552,WASHROOM METAL SIGN,1.0,10/4/11 14:53,1.45,12512
569527,21328,BALLOONS  WRITING SET,3.0,10/4/11 14:53,1.65,12512
569527,,WRAP ENGLISH ROSE,25.0,10/4/11 14:53,0.42,12512
569529,,RED RETROSPOT UMBRELLA,1.0,10/4/11 14:55,5.95,12512
569529,20682,RED RETROSPOT CHILDRENS UMBRELLA,3.0,10/4/11 14:55,3.25,12512
