581193,,3 WHITE CHOC MORRIS BOXED CANDLES,4.0,12/7/11 17:05,1.25,17097
581193,84843,WHITE SOAP RACK WITH 2 BOTTLES,2.0,12/7/11 17:05,5.95,17097
581193,21216,"SET 3 RETROSPOT TEA,COFFEE,SUGAR",1.0,12/7/11 17:05,4.95,17097
581193,23321,SMALL WHITE HEART OF WICKER,1.0,12/7/11 17:05,1.65,17097
581193,22469,HEART OF WICKER SMALL,1.0,12/7/11 17:05,1.65,17097
581193,21883,STARS GIFT TAPE,2.0,12/7/11 17:05,0.65,17097
581193,21880,RED RETROSPOT TAPE,2.0,12/7/11 17:05,0.65,17097
581193,23493,VINTAGE DOILY TRAVEL SEWING KIT,2.0,12/7/11 17:05,1.95,17097
581193,22645,CERAMIC HEART FAIRY CAKE MONEY BANK,1.0,12/7/11 17:05,0.39,17097
581193,22644,CERAMIC CHERRY CAKE MONEY BANK,1.0,12/7/11 17:05,0.39,17097
581193,22464,HANGING METAL HEART LANTERN,1.0,12/7/11 17:05,0.79,17097
581193,22465,HANGING METAL STAR LANTERN,1.0,12/7/11 17:05,0.79,17097
581193,,WHITE HANGING HEART T-LIGHT HOLDER,1.0,12/7/11 17:05,2.95,17097
581193,21733,RED HANGING HEART T-LIGHT HOLDER,1.0,12/7/11 17:05,2.95,17097
581193,22219,LOVEBIRD HANGING DECORATION WHITE,4.0,12/7/11 17:05,0.85,17097
581193,23265,SET OF 3 WOODEN TREE DECORATIONS,2.0,12/7/11 17:05,1.25,17097
581193,23227,FILIGREE HEART BUTTERFLY WHITE,4.0,12/7/11 17:05,1.25,17097
581193,23266,SET OF 3 WOODEN STOCKING DECORATION,2.0,12/7/11 17:05,1.25,17097
581193,23264,SET OF 3 WOODEN SLEIGH DECORATIONS,2.0,12/7/11 17:05,1.25,17097
581193,23263,SET OF 3 WOODEN HEART DECORATIONS,2.0,12/7/11 17:05,1.25,17097
581193,72741,GRAND CHOCOLATECANDLE,9.0,12/7/11 17:05,1.45,17097
581193,23452,HEART MINI PORTRAIT FRAME,2.0,12/7/11 17:05,1.95,17097
581193,22907,PACK OF 20 NAPKINS PANTRY DESIGN,1.0,12/7/11 17:05,0.85,17097
581193,22851,SET 20 NAPKINS FAIRY CAKES DESIGN,1.0,12/7/11 17:05,0.85,17097
581193,23209,LUNCH BAG VINTAGE DOILY,1.0,12/7/11 17:05,1.65,17097
581193,22662,LUNCH BAG DOLLY GIRL DESIGN,1.0,12/7/11 17:05,1.65,17097
581193,23583,LUNCH BAG PAISLEY PARK,1.0,12/7/11 17:05,1.65,17097
581193,22896,PEG BAG APPLES DESIGN,1.0,12/7/11 17:05,2.55,17097
581193,23203,JUMBO BAG VINTAGE DOILY,1.0,12/7/11 17:05,2.08,17097
581193,22393,PAPERWEIGHT VINTAGE COLLAGE,2.0,12/7/11 17:05,0.39,17097
581193,22391,PAPERWEIGHT HOME SWEET HOME,2.0,12/7/11 17:05,0.39,17097
581193,23454,THREE MINI HANGING FRAMES,1.0,12/7/11 17:05,4.15,17097
581193,,ENGLISH ROSE NOTEBOOK A7 SIZE,2.0,12/7/11 17:05,0.42,17097
581193,,FAIRY CAKES NOTEBOOK A6 SIZE,2.0,12/7/11 17:05,0.65,17097
581193,22755,SMALL PURPLE BABUSHKA NOTEBOOK,1.0,12/7/11 17:05,0.21,17097
581193,22753,SMALL YELLOW BABUSHKA NOTEBOOK,1.0,12/7/11 17:05,0.21,17097
581193,22754,SMALL RED BABUSHKA NOTEBOOK,1.0,12/7/11 17:05,0.21,17097
581193,23372,SET 36 COLOUR PENCILS DOLLY GIRL,1.0,12/7/11 17:05,1.25,17097
581193,23371,SET 36 COLOUR PENCILS SPACEBOY,1.0,12/7/11 17:05,1.25,17097
581193,23254,CHILDRENS CUTLERY DOLLY GIRL,1.0,12/7/11 17:05,4.15,17097
581193,22326,ROUND SNACK BOXES SET OF4 WOODLAND,2.0,12/7/11 17:05,2.95,17097
581193,22629,SPACEBOY LUNCH BOX,1.0,12/7/11 17:05,1.95,17097
581193,22631,CIRCUS PARADE LUNCH BOX,1.0,12/7/11 17:05,1.95,17097
581193,23290,SPACEBOY CHILDRENS BOWL,2.0,12/7/11 17:05,1.25,17097
581193,23289,DOLLY GIRL CHILDRENS BOWL,2.0,12/7/11 17:05,1.25,17097
581193,23292,SPACEBOY CHILDRENS CUP,2.0,12/7/11 17:05,1.25,17097
581193,23291,DOLLY GIRL CHILDRENS CUP,2.0,12/7/11 17:05,1.25,17097
581193,,SET/3 DECOUPAGE STACKING TINS,1.0,12/7/11 17:05,4.95,17097
581193,22721,SET OF 3 CAKE TINS SKETCHBOOK,2.0,12/7/11 17:05,1.95,17097
581193,23241,TREASURE TIN GYMKHANA DESIGN,1.0,12/7/11 17:05,2.08,17097
581193,23247,BISCUIT TIN 50'S CHRISTMAS,1.0,12/7/11 17:05,2.89,17097
