563477,22243,5 HOOK HANGER RED MAGIC TOADSTOOL,1.0,8/16/11 15:39,1.65,17097
563477,22244,3 HOOK HANGER MAGIC GARDEN,1.0,8/16/11 15:39,1.95,17097
563477,,TEA TIME OVEN GLOVE,1.0,8/16/11 15:39,1.25,17097
563477,20711,JUMBO BAG TOYS,1.0,8/16/11 15:39,2.08,17097
563477,22663,JUMBO BAG DOLLY GIRL DESIGN,2.0,8/16/11 15:39,2.08,17097
563477,23203,JUMBO BAG VINTAGE DOILY,2.0,8/16/11 15:39,2.08,17097
563477,21340,CLASSIC METAL BIRDCAGE PLANT HOLDER,1.0,8/16/11 15:39,12.75,17097
563477,23172,REGENCY TEA PLATE PINK,2.0,8/16/11 15:39,1.65,17097
563477,23171,REGENCY TEA PLATE GREEN,4.0,8/16/11 15:39,1.65,17097
563477,23170,REGENCY TEA PLATE ROSES,4.0,8/16/11 15:39,1.65,17097
563477,23174,REGENCY SUGAR BOWL GREEN,1.0,8/16/11 15:39,4.15,17097
563477,22699,ROSES REGENCY TEACUP AND SAUCER,5.0,8/16/11 15:39,2.95,17097
563477,22727,ALARM CLOCK BAKELIKE RED,1.0,8/16/11 15:39,3.75,17097
563477,22726,ALARM CLOCK BAKELIKE GREEN,1.0,8/16/11 15:39,3.75,17097
563477,22326,ROUND SNACK BOXES SET OF4 WOODLAND,2.0,8/16/11 15:39,2.95,17097
563477,72741,GRAND CHOCOLATECANDLE,9.0,8/16/11 15:39,1.45,17097
563477,23173,REGENCY TEAPOT ROSES,1.0,8/16/11 15:39,9.95,17097
563477,23245,SET OF 3 REGENCY CAKE TINS,2.0,8/16/11 15:39,4.95,17097
563477,23236,STORAGE TIN VINTAGE DOILY,1.0,8/16/11 15:39,2.89,17097
563477,23240,SET OF 4 KNICK KNACK TINS DOILY,1.0,8/16/11 15:39,4.15,17097
563477,23241,TREASURE TIN GYMKHANA DESIGN,1.0,8/16/11 15:39,2.08,17097
563477,22630,DOLLY GIRL LUNCH BOX,2.0,8/16/11 15:39,1.95,17097
563477,23005,TRAVEL CARD WALLET I LOVE LONDON,2.0,8/16/11 15:39,0.42,17097
563477,22646,CERAMIC STRAWBERRY CAKE MONEY BANK,1.0,8/16/11 15:39,1.45,17097
563477,22644,CERAMIC CHERRY CAKE MONEY BANK,1.0,8/16/11 15:39,1.45,17097
563477,22645,CERAMIC HEART FAIRY CAKE MONEY BANK,1.0,8/16/11 15:39,1.45,17097
563477,22399,MAGNETS PACK OF 4 CHILDHOOD MEMORY,3.0,8/16/11 15:39,1.25,17097
563477,23291,DOLLY GIRL CHILDRENS CUP,1.0,8/16/11 15:39,1.25,17097
563477,23292,SPACEBOY CHILDRENS CUP,1.0,8/16/11 15:39,1.25,17097
563477,23290,SPACEBOY CHILDRENS BOWL,1.0,8/16/11 15:39,1.25,17097
563477,23289,DOLLY GIRL CHILDRENS BOWL,1.0,8/16/11 15:39,1.25,17097
563477,23146,TRIPLE HOOK ANTIQUE IVORY ROSE,2.0,8/16/11 15:39,3.29,17097
563477,23147,SINGLE ANTIQUE ROSE HOOK IVORY,4.0,8/16/11 15:39,1.45,17097
563477,21745,GAOLERS KEYS DECORATIVE GARDEN,1.0,8/16/11 15:39,3.75,17097
563477,21578,WOODLAND DESIGN  COTTON TOTE BAG,2.0,8/16/11 15:39,2.25,17097
563477,21580,RABBIT  DESIGN  COTTON TOTE BAG,1.0,8/16/11 15:39,2.25,17097
563477,22662,LUNCH BAG DOLLY GIRL DESIGN,2.0,8/16/11 15:39,1.65,17097
563477,23209,LUNCH BAG VINTAGE DOILY,2.0,8/16/11 15:39,1.65,17097
563477,21034,REX CASH+CARRY JUMBO SHOPPER,1.0,8/16/11 15:39,0.95,17097
563477,20726,LUNCH BAG WOODLAND,2.0,8/16/11 15:39,1.65,17097
563482,21216,"SET 3 RETROSPOT TEA,COFFEE,SUGAR",1.0,8/16/11 15:54,4.95,17097
563482,23256,CHILDRENS CUTLERY SPACEBOY,1.0,8/16/11 15:54,4.15,17097
563482,23254,CHILDRENS CUTLERY DOLLY GIRL,2.0,8/16/11 15:54,4.15,17097
563482,,CHILDRENS CUTLERY POLKADOT PINK,1.0,8/16/11 15:54,4.15,17097
563482,23255,CHILDRENS CUTLERY CIRCUS PARADE,1.0,8/16/11 15:54,4.15,17097
563482,,CHILDRENS CUTLERY POLKADOT BLUE,1.0,8/16/11 15:54,4.15,17097
563518,21232,STRAWBERRY CERAMIC TRINKET BOX,24.0,8/17/11 10:56,1.25,12421
563518,22646,CERAMIC STRAWBERRY CAKE MONEY BANK,24.0,8/17/11 10:56,1.45,12421
563518,,TEA TIME KITCHEN APRON,6.0,8/17/11 10:56,5.95,12421
563518,37495,FAIRY CAKE BIRTHDAY CANDLE SET,4.0,8/17/11 10:56,3.75,12421
563518,84991,60 TEATIME FAIRY CAKE CASES,24.0,8/17/11 10:56,0.55,12421
563518,,FAIRY CAKES NOTEBOOK A6 SIZE,16.0,8/17/11 10:56,0.65,12421
563518,21519,GIN & TONIC DIET GREETING CARD,24.0,8/17/11 10:56,0.42,12421
563518,21520,BOOZE & WOMEN GREETING CARD,12.0,8/17/11 10:56,0.42,12421
563518,22026,BANQUET BIRTHDAY  CARD,12.0,8/17/11 10:56,0.42,12421
563518,21933,PINK VINTAGE PAISLEY PICNIC BAG,10.0,8/17/11 10:56,1.65,12421
563518,,POSTAGE,2.0,8/17/11 10:56,28.0,12421
,22726,ALARM CLOCK BAKELIKE GREEN,-1.0,8/21/11 10:55,3.75,17097
,21340,CLASSIC METAL BIRDCAGE PLANT HOLDER,-1.0,8/21/11 10:55,12.75,17097
563901,23174,REGENCY SUGAR BOWL GREEN,2.0,8/21/11 11:05,4.15,17097
563901,23245,SET OF 3 REGENCY CAKE TINS,1.0,8/21/11 11:05,4.95,17097
564201,22138,BAKING SET 9 PIECE RETROSPOT,6.0,8/24/11 8:09,4.95,12540
564201,23198,PANTRY MAGNETIC  SHOPPING LIST,12.0,8/24/11 8:09,1.45,12540
564201,23159,SET OF 5 PANCAKE DAY MAGNETS,24.0,8/24/11 8:09,2.08,12540
564201,23154,SET OF 4 JAM JAR MAGNETS,12.0,8/24/11 8:09,2.08,12540
564201,23158,SET OF 5 LUCKY CAT MAGNETS,24.0,8/24/11 8:09,2.08,12540
564201,23156,SET OF 5 MINI GROCERY MAGNETS,24.0,8/24/11 8:09,2.08,12540
564201,84077,WORLD WAR 2 GLIDERS ASSTD DESIGNS,48.0,8/24/11 8:09,0.29,12540
564201,23298,SPOTTY BUNTING,6.0,8/24/11 8:09,4.95,12540
564201,21380,WOODEN HAPPY BIRTHDAY GARLAND,6.0,8/24/11 8:09,2.95,12540
564201,84879,ASSORTED COLOUR BIRD ORNAMENT,40.0,8/24/11 8:09,1.69,12540
564201,22079,RIBBON REEL HEARTS DESIGN,10.0,8/24/11 8:09,1.65,12540
564201,22077,6 RIBBONS RUSTIC CHARM,12.0,8/24/11 8:09,1.65,12540
564201,,CHOCOLATE BOX RIBBONS,12.0,8/24/11 8:09,1.25,12540
564201,23245,SET OF 3 REGENCY CAKE TINS,4.0,8/24/11 8:09,4.95,12540
564201,23546,WRAP PAISLEY PARK,25.0,8/24/11 8:09,0.42,12540
564201,23548,WRAP MAGIC FOREST,25.0,8/24/11 8:09,0.42,12540
564201,23547,WRAP FLOWER SHOP,25.0,8/24/11 8:09,0.42,12540
564201,,POSTAGE,2.0,8/24/11 8:09,28.0,12540
564734,22197,POPCORN HOLDER,18.0,8/28/11 13:32,0.85,12484
564734,21500,PINK POLKADOT WRAP,25.0,8/28/11 13:32,0.42,12484
564734,21499,BLUE POLKADOT WRAP,25.0,8/28/11 13:32,0.42,12484
564734,22507,MEMO BOARD RETROSPOT  DESIGN,4.0,8/28/11 13:32,4.95,12484
564734,22505,MEMO BOARD COTTAGE DESIGN,3.0,8/28/11 13:32,4.95,12484
564734,22720,SET OF 3 CAKE TINS PANTRY DESIGN,2.0,8/28/11 13:32,4.95,12484
564734,22752,SET 7 BABUSHKA NESTING BOXES,1.0,8/28/11 13:32,8.5,12484
564734,22189,CREAM HEART CARD HOLDER,2.0,8/28/11 13:32,3.95,12484
564734,21251,DINOSAUR HEIGHT CHART STICKER SET,6.0,8/28/11 13:32,2.95,12484
564734,21623,VINTAGE UNION JACK MEMOBOARD,1.0,8/28/11 13:32,9.95,12484
564734,22804,CANDLEHOLDER PINK HANGING HEART,3.0,8/28/11 13:32,2.95,12484
564734,20686,DOLLY MIXTURE CHILDREN'S UMBRELLA,2.0,8/28/11 13:32,3.25,12484
564734,22990,COTTON APRON PANTRY DESIGN,6.0,8/28/11 13:32,4.95,12484
564734,22989,SET 2 PANTRY DESIGN TEA TOWELS,6.0,8/28/11 13:32,3.25,12484
564734,22965,3 TRADITIONAl BISCUIT CUTTERS  SET,6.0,8/28/11 13:32,2.1,12484
564734,22429,ENAMEL MEASURING JUG CREAM,3.0,8/28/11 13:32,4.25,12484
564734,22906,12 MESSAGE CARDS WITH ENVELOPES,12.0,8/28/11 13:32,1.65,12484
564734,22993,SET OF 4 PANTRY JELLY MOULDS,6.0,8/28/11 13:32,1.25,12484
564734,84826,ASSTD DESIGN 3D PAPER STICKERS,60.0,8/28/11 13:32,0.85,12484
564734,,ROSE SCENT CANDLE IN JEWELLED BOX,3.0,8/28/11 13:32,4.25,12484
564734,72132,COLUMBIAN CUBE CANDLE,2.0,8/28/11 13:32,1.95,12484
564734,72134,COLUMBIAN  CUBE CANDLE,2.0,8/28/11 13:32,0.85,12484
564734,21624,VINTAGE UNION JACK DOORSTOP,1.0,8/28/11 13:32,5.95,12484
564734,72131,COLUMBIAN CANDLE RECTANGLE,1.0,8/28/11 13:32,1.95,12484
564734,,ROSE SCENT CANDLE JEWELLED DRAWER,3.0,8/28/11 13:32,4.25,12484
564734,,SET/3 ROSE CANDLE IN JEWELLED BOX,3.0,8/28/11 13:32,4.25,12484
564734,22090,PAPER BUNTING RETROSPOT,2.0,8/28/11 13:32,2.95,12484
564734,23076,ICE CREAM SUNDAE LIP GLOSS,24.0,8/28/11 13:32,1.25,12484
564734,23310,BUBBLEGUM RING ASSORTED,36.0,8/28/11 13:32,0.42,12484
564734,,WOODEN FRAME ANTIQUE WHITE,2.0,8/28/11 13:32,2.95,12484
564734,82482,WOODEN PICTURE FRAME WHITE FINISH,2.0,8/28/11 13:32,2.55,12484
564734,22645,CERAMIC HEART FAIRY CAKE MONEY BANK,4.0,8/28/11 13:32,1.45,12484
564734,84077,WORLD WAR 2 GLIDERS ASSTD DESIGNS,48.0,8/28/11 13:32,0.29,12484
564734,23184,BULL DOG BOTTLE OPENER,2.0,8/28/11 13:32,4.95,12484
564734,72131,COLUMBIAN CANDLE RECTANGLE,1.0,8/28/11 13:32,1.95,12484
564734,22693,GROW A FLYTRAP OR SUNFLOWER IN TIN,24.0,8/28/11 13:32,1.25,12484
564734,20970,PINK FLORAL FELTCRAFT SHOULDER BAG,4.0,8/28/11 13:32,3.75,12484
564734,20971,PINK BLUE FELT CRAFT TRINKET BOX,6.0,8/28/11 13:32,1.25,12484
564734,22611,VINTAGE UNION JACK SHOPPING BAG,1.0,8/28/11 13:32,4.95,12484
564734,21625,VINTAGE UNION JACK APRON,1.0,8/28/11 13:32,6.95,12484
564734,22384,LUNCH BAG PINK POLKADOT,4.0,8/28/11 13:32,1.65,12484
564734,,BLUE HAPPY BIRTHDAY BUNTING,4.0,8/28/11 13:32,5.45,12484
564734,,TEA TIME PARTY BUNTING,3.0,8/28/11 13:32,4.95,12484
564734,23298,SPOTTY BUNTING,3.0,8/28/11 13:32,4.95,12484
564734,47566,PARTY BUNTING,3.0,8/28/11 13:32,4.95,12484
564734,,PINK HAPPY BIRTHDAY BUNTING,4.0,8/28/11 13:32,5.45,12484
564734,20727,LUNCH BAG  BLACK SKULL.,4.0,8/28/11 13:32,1.65,12484
564734,22380,TOY TIDY SPACEBOY,1.0,8/28/11 13:32,2.1,12484
564734,22355,CHARLOTTE BAG SUKI DESIGN,6.0,8/28/11 13:32,0.85,12484
564734,22940,FELTCRAFT CHRISTMAS FAIRY,6.0,8/28/11 13:32,4.25,12484
564734,20728,LUNCH BAG CARS BLUE,3.0,8/28/11 13:32,1.65,12484
564734,22383,LUNCH BAG SUKI DESIGN,6.0,8/28/11 13:32,1.65,12484
564734,22382,LUNCH BAG SPACEBOY DESIGN,3.0,8/28/11 13:32,1.65,12484
564734,21124,SET/10 BLUE POLKADOT PARTY CANDLES,24.0,8/28/11 13:32,1.25,12484
564734,21122,SET/10 PINK POLKADOT PARTY CANDLES,24.0,8/28/11 13:32,1.25,12484
564734,85116,BLACK CANDELABRA T-LIGHT HOLDER,5.0,8/28/11 13:32,0.65,12484
564734,22083,PAPER CHAIN KIT RETROSPOT,6.0,8/28/11 13:32,2.95,12484
564734,21993,FLORAL FOLK STATIONERY SET,3.0,8/28/11 13:32,1.25,12484
564734,21992,VINTAGE PAISLEY STATIONERY SET,3.0,8/28/11 13:32,1.25,12484
564734,,FLOWER FAIRY 5 DRAWER LINERS,4.0,8/28/11 13:32,2.55,12484
564734,,VANILLA INCENSE IN TIN,6.0,8/28/11 13:32,0.38,12484
564734,23198,PANTRY MAGNETIC  SHOPPING LIST,2.0,8/28/11 13:32,1.45,12484
564734,22210,WOOD STAMP SET BEST WISHES,3.0,8/28/11 13:32,0.83,12484
564734,22209,WOOD STAMP SET HAPPY BIRTHDAY,3.0,8/28/11 13:32,0.83,12484
564734,22937,BAKING MOULD CHOCOLATE CUPCAKES,6.0,8/28/11 13:32,2.55,12484
564734,11001,ASSTD DESIGN RACING CAR PEN,16.0,8/28/11 13:32,1.69,12484
564734,22195,LARGE HEART MEASURING SPOONS,2.0,8/28/11 13:32,1.65,12484
564734,,CHOCOLATE BOX RIBBONS,1.0,8/28/11 13:32,1.25,12484
564734,22743,MAKE YOUR OWN FLOWERPOWER CARD KIT,4.0,8/28/11 13:32,2.95,12484
564734,22742,MAKE YOUR OWN PLAYTIME CARD KIT,4.0,8/28/11 13:32,2.95,12484
564734,84375,SET OF 20 KIDS COOKIE CUTTERS,6.0,8/28/11 13:32,2.1,12484
564734,22629,SPACEBOY LUNCH BOX,3.0,8/28/11 13:32,1.95,12484
564734,,SET/6 PINK  BUTTERFLY T-LIGHTS,4.0,8/28/11 13:32,2.1,12484
564734,,SET/6 PURPLE BUTTERFLY T-LIGHTS,5.0,8/28/11 13:32,2.1,12484
564734,21544,SKULLS  WATER TRANSFER TATTOOS,10.0,8/28/11 13:32,0.85,12484
564734,21126,SET OF 6 GIRLS CELEBRATION CANDLES,6.0,8/28/11 13:32,1.25,12484
564734,,SCANDINAVIAN REDS RIBBONS,1.0,8/28/11 13:32,1.25,12484
564734,22075,6 RIBBONS ELEGANT CHRISTMAS,1.0,8/28/11 13:32,1.65,12484
564734,,TRADITIONAL CHRISTMAS RIBBONS,1.0,8/28/11 13:32,1.25,12484
564734,,CHOCOLATE BOX RIBBONS,5.0,8/28/11 13:32,1.25,12484
564734,,BABY BOOM RIBBONS,6.0,8/28/11 13:32,1.25,12484
564734,22074,6 RIBBONS SHIMMERING PINKS,6.0,8/28/11 13:32,1.65,12484
564734,84378,SET OF 3 HEART COOKIE CUTTERS,6.0,8/28/11 13:32,1.25,12484
564734,84380,SET OF 3 BUTTERFLY COOKIE CUTTERS,5.0,8/28/11 13:32,1.25,12484
564734,22966,GINGERBREAD MAN COOKIE CUTTER,2.0,8/28/11 13:32,1.25,12484
564734,22992,REVOLVER WOODEN RULER,6.0,8/28/11 13:32,1.95,12484
564734,22938,CUPCAKE LACE PAPER SET 6,12.0,8/28/11 13:32,1.95,12484
564734,20992,JAZZ HEARTS PURSE NOTEBOOK,6.0,8/28/11 13:32,0.39,12484
564734,21063,PARTY INVITES JAZZ HEARTS,6.0,8/28/11 13:32,0.85,12484
564734,21059,PARTY INVITES DINOSAURS,8.0,8/28/11 13:32,0.85,12484
564734,22588,CARD HOLDER GINGHAM HEART,3.0,8/28/11 13:32,2.89,12484
564734,,"FEATHER PEN,LIGHT PINK",12.0,8/28/11 13:32,0.39,12484
564734,,"FEATHER PEN,HOT PINK",12.0,8/28/11 13:32,0.39,12484
564734,22283,6 EGG HOUSE PAINTED WOOD,1.0,8/28/11 13:32,7.95,12484
564734,21329,DINOSAURS  WRITING SET,6.0,8/28/11 13:32,1.65,12484
564734,21356,TOAST ITS - FAIRY FLOWER,6.0,8/28/11 13:32,1.25,12484
564734,21358,TOAST ITS - HAPPY BIRTHDAY,6.0,8/28/11 13:32,1.25,12484
564734,21328,BALLOONS  WRITING SET,6.0,8/28/11 13:32,1.65,12484
564734,22991,GIRAFFE WOODEN RULER,6.0,8/28/11 13:32,1.95,12484
564734,,SMALL CHOCOLATES PINK BOWL,8.0,8/28/11 13:32,0.42,12484
564734,,SMALL MARSHMALLOWS PINK BOWL,16.0,8/28/11 13:32,0.42,12484
564734,,SMALL DOLLY MIX DESIGN ORANGE BOWL,16.0,8/28/11 13:32,0.42,12484
564734,22932,BAKING MOULD TOFFEE CUP CHOCOLATE,3.0,8/28/11 13:32,2.55,12484
564734,22931,BAKING MOULD HEART WHITE CHOCOLATE,3.0,8/28/11 13:32,2.55,12484
564734,22282,12 EGG HOUSE PAINTED WOOD,1.0,8/28/11 13:32,12.75,12484
564734,22367,CHILDRENS APRON SPACEBOY DESIGN,4.0,8/28/11 13:32,1.95,12484
564734,21561,DINOSAUR LUNCH BOX WITH CUTLERY,6.0,8/28/11 13:32,2.55,12484
564734,,TEA TIME OVEN GLOVE,1.0,8/28/11 13:32,1.25,12484
564734,47580,TEA TIME DES TEA COSY,1.0,8/28/11 13:32,2.55,12484
564734,47580,TEA TIME DES TEA COSY,1.0,8/28/11 13:32,2.55,12484
564734,,TEA TIME OVEN GLOVE,3.0,8/28/11 13:32,1.25,12484
564734,22278,OVERNIGHT BAG VINTAGE ROSE PAISLEY,3.0,8/28/11 13:32,4.95,12484
564734,22276,WASH BAG VINTAGE ROSE PAISLEY,2.0,8/28/11 13:32,2.55,12484
564734,,TEA TIME KITCHEN APRON,5.0,8/28/11 13:32,5.95,12484
564734,22416,SET OF 36 DOILIES SPACEBOY DESIGN,3.0,8/28/11 13:32,1.45,12484
564734,21211,SET OF 72 SKULL PAPER  DOILIES,3.0,8/28/11 13:32,1.45,12484
564734,21972,SET OF 36 DINOSAUR PAPER DOILIES,5.0,8/28/11 13:32,1.45,12484
564734,84987,SET OF 36 TEATIME PAPER DOILIES,6.0,8/28/11 13:32,1.45,12484
564734,22278,OVERNIGHT BAG VINTAGE ROSE PAISLEY,2.0,8/28/11 13:32,4.95,12484
564734,23306,SET OF 36 DOILIES PANTRY DESIGN,6.0,8/28/11 13:32,1.45,12484
564734,,PINK FAIRY CAKE CHILDRENS APRON,4.0,8/28/11 13:32,1.95,12484
564734,20711,JUMBO BAG TOYS,6.0,8/28/11 13:32,2.08,12484
564858,,POSTAGE,5.0,8/31/11 9:44,28.0,12484
564975,23175,REGENCY MILK JUG PINK,1.0,8/31/11 15:35,3.25,17097
564975,21774,DECORATIVE CATS BATHROOM BOTTLE,6.0,8/31/11 15:35,1.25,17097
564975,23172,REGENCY TEA PLATE PINK,2.0,8/31/11 15:35,1.65,17097
564975,23170,REGENCY TEA PLATE ROSES,2.0,8/31/11 15:35,1.65,17097
564975,23171,REGENCY TEA PLATE GREEN,2.0,8/31/11 15:35,1.65,17097
564975,84843,WHITE SOAP RACK WITH 2 BOTTLES,1.0,8/31/11 15:35,5.95,17097
564975,21135,VICTORIAN  METAL POSTCARD SPRING,2.0,8/31/11 15:35,1.69,17097
564975,,WHITE HANGING HEART T-LIGHT HOLDER,2.0,8/31/11 15:35,2.95,17097
564975,21217,RED RETROSPOT ROUND CAKE TINS,1.0,8/31/11 15:35,9.95,17097
564975,22699,ROSES REGENCY TEACUP AND SAUCER,4.0,8/31/11 15:35,2.95,17097
564975,22969,HOMEMADE JAM SCENTED CANDLES,12.0,8/31/11 15:35,1.45,17097
564975,23174,REGENCY SUGAR BOWL GREEN,1.0,8/31/11 15:35,4.15,17097
564975,21135,VICTORIAN  METAL POSTCARD SPRING,8.0,8/31/11 15:35,1.69,17097
564975,21216,"SET 3 RETROSPOT TEA,COFFEE,SUGAR",1.0,8/31/11 15:35,4.95,17097
564975,21034,REX CASH+CARRY JUMBO SHOPPER,1.0,8/31/11 15:35,0.95,17097
564975,23173,REGENCY TEAPOT ROSES,4.0,8/31/11 15:35,9.95,17097
565519,22423,REGENCY CAKESTAND 3 TIER,16.0,9/5/11 11:52,10.95,12502
565519,21524,DOORMAT SPOTTY HOME SWEET HOME,2.0,9/5/11 11:52,8.25,12502
565519,22691,DOORMAT WELCOME SUNRISE,2.0,9/5/11 11:52,8.25,12502
565519,22692,DOORMAT WELCOME TO OUR HOME,2.0,9/5/11 11:52,8.25,12502
565519,48187,DOORMAT NEW ENGLAND,2.0,9/5/11 11:52,8.25,12502
565519,48188,DOORMAT WELCOME PUPPIES,2.0,9/5/11 11:52,8.25,12502
565519,48194,DOORMAT HEARTS,2.0,9/5/11 11:52,8.25,12502
565519,,JUMBO BAG RED RETROSPOT,10.0,9/5/11 11:52,2.08,12502
565519,22799,SWEETHEART WIRE FRUIT BOWL,2.0,9/5/11 11:52,8.5,12502
565519,23111,PARISIENNE SEWING BOX,4.0,9/5/11 11:52,12.5,12502
565519,23118,PARISIENNE JEWELLERY DRAWER,2.0,9/5/11 11:52,7.5,12502
565519,22195,LARGE HEART MEASURING SPOONS,12.0,9/5/11 11:52,1.65,12502
565519,22697,GREEN REGENCY TEACUP AND SAUCER,6.0,9/5/11 11:52,2.95,12502
565519,22698,PINK REGENCY TEACUP AND SAUCER,6.0,9/5/11 11:52,2.95,12502
565519,22699,ROSES REGENCY TEACUP AND SAUCER,6.0,9/5/11 11:52,2.95,12502
565519,22990,COTTON APRON PANTRY DESIGN,2.0,9/5/11 11:52,4.95,12502
565519,,BLACK/BLUE POLKADOT UMBRELLA,3.0,9/5/11 11:52,5.95,12502
565519,22725,ALARM CLOCK BAKELIKE CHOCOLATE,4.0,9/5/11 11:52,3.75,12502
565519,22741,FUNKY DIVA PEN,48.0,9/5/11 11:52,0.85,12502
565519,20685,DOORMAT RED RETROSPOT,2.0,9/5/11 11:52,8.25,12502
565519,20682,RED RETROSPOT CHILDRENS UMBRELLA,6.0,9/5/11 11:52,3.25,12502
565519,21156,RETROSPOT CHILDRENS APRON,8.0,9/5/11 11:52,1.95,12502
565519,22139,RETROSPOT TEA SET CERAMIC 11 PC,3.0,9/5/11 11:52,4.95,12502
565519,22939,ADULT APRON APPLE DELIGHT,4.0,9/5/11 11:52,4.95,12502
565519,,GREEN VINTAGE EARRINGS,4.0,9/5/11 11:52,3.75,12502
565519,90145,SILVER HOOP EARRINGS WITH FLOWER,2.0,9/5/11 11:52,5.95,12502
565519,90192,JADE DROP EARRINGS W FILIGREE,3.0,9/5/11 11:52,4.95,12502
565519,21429,RED GINGHAM ROSE JEWELLERY BOX,8.0,9/5/11 11:52,1.95,12502
565519,22383,LUNCH BAG SUKI DESIGN,10.0,9/5/11 11:52,1.65,12502
565519,,IVORY ENCHANTED FOREST PLACEMAT,12.0,9/5/11 11:52,1.65,12502
565519,,RED ENCHANTED FOREST PLACEMAT,12.0,9/5/11 11:52,1.65,12502
565519,22215,CAKE STAND WHITE TWO TIER LACE,4.0,9/5/11 11:52,8.5,12502
565519,22220,CAKE STAND LOVEBIRD 2 TIER WHITE,2.0,9/5/11 11:52,9.95,12502
565519,22846,BREAD BIN DINER STYLE RED,2.0,9/5/11 11:52,16.95,12502
565519,23316,RED REFECTORY CLOCK,2.0,9/5/11 11:52,9.95,12502
565519,23356,LOVE HOT WATER BOTTLE,3.0,9/5/11 11:52,5.95,12502
565519,23245,SET OF 3 REGENCY CAKE TINS,4.0,9/5/11 11:52,4.95,12502
565519,,RED RETROSPOT UMBRELLA,3.0,9/5/11 11:52,5.95,12502
565519,,POSTAGE,7.0,9/5/11 11:52,28.0,12502
566040,22144,CHRISTMAS CRAFT LITTLE FRIENDS,6.0,9/8/11 13:38,2.1,12540
566040,22863,SOAP DISH BROCANTE,8.0,9/8/11 13:38,2.95,12540
566040,22969,HOMEMADE JAM SCENTED CANDLES,24.0,9/8/11 13:38,1.45,12540
566040,22423,REGENCY CAKESTAND 3 TIER,1.0,9/8/11 13:38,12.75,12540
566040,21407,BROWN CHECK CAT DOORSTOP,3.0,9/8/11 13:38,4.25,12540
566040,23275,SET OF 3 HANGING OWLS OLLIE BEAK,24.0,9/8/11 13:38,1.25,12540
566040,,SMALL HANGING IVORY/RED WOOD BIRD,24.0,9/8/11 13:38,0.42,12540
566040,23154,SET OF 4 JAM JAR MAGNETS,12.0,9/8/11 13:38,2.08,12540
566040,22846,BREAD BIN DINER STYLE RED,1.0,9/8/11 13:38,16.95,12540
566040,22847,BREAD BIN DINER STYLE IVORY,1.0,9/8/11 13:38,16.95,12540
566040,22848,BREAD BIN DINER STYLE PINK,1.0,9/8/11 13:38,16.95,12540
566040,84380,SET OF 3 BUTTERFLY COOKIE CUTTERS,12.0,9/8/11 13:38,1.45,12540
566040,22727,ALARM CLOCK BAKELIKE RED,4.0,9/8/11 13:38,3.75,12540
566040,22028,PENNY FARTHING BIRTHDAY CARD,12.0,9/8/11 13:38,0.42,12540
566040,21524,DOORMAT SPOTTY HOME SWEET HOME,2.0,9/8/11 13:38,8.25,12540
566040,84755,COLOUR GLASS T-LIGHT HOLDER HANGING,16.0,9/8/11 13:38,0.65,12540
566040,23197,SKETCHBOOK MAGNETIC SHOPPING LIST,24.0,9/8/11 13:38,1.45,12540
566040,21877,HOME SWEET HOME MUG,12.0,9/8/11 13:38,1.65,12540
566040,23433,HANGING QUILTED PATCHWORK APPLES,12.0,9/8/11 13:38,0.83,12540
566040,23076,ICE CREAM SUNDAE LIP GLOSS,24.0,9/8/11 13:38,1.25,12540
566040,22326,ROUND SNACK BOXES SET OF4 WOODLAND,6.0,9/8/11 13:38,2.95,12540
566040,23213,STAR WREATH DECORATION WITH BELL,12.0,9/8/11 13:38,1.25,12540
566040,,POSTAGE,2.0,9/8/11 13:38,28.0,12540
567340,23080,RED METAL BOX TOP SECRET,2.0,9/19/11 15:02,8.25,12540
567340,23081,GREEN METAL BOX ARMY SUPPLIES,2.0,9/19/11 15:02,8.25,12540
567340,23242,TREASURE TIN BUFFALO BILL,12.0,9/19/11 15:02,2.08,12540
567340,23241,TREASURE TIN GYMKHANA DESIGN,12.0,9/19/11 15:02,2.08,12540
567340,84077,WORLD WAR 2 GLIDERS ASSTD DESIGNS,48.0,9/19/11 15:02,0.29,12540
567340,22556,PLASTERS IN TIN CIRCUS PARADE,24.0,9/19/11 15:02,1.65,12540
567340,22553,PLASTERS IN TIN SKULLS,24.0,9/19/11 15:02,1.65,12540
567340,23079,TOADSTOOL BEDSIDE LIGHT,2.0,9/19/11 15:02,8.95,12540
567340,22329,ROUND CONTAINER SET OF 5 RETROSPOT,12.0,9/19/11 15:02,1.65,12540
567340,21212,PACK OF 72 RETROSPOT CAKE CASES,24.0,9/19/11 15:02,0.55,12540
567340,21213,PACK OF 72 SKULL CAKE CASES,24.0,9/19/11 15:02,0.55,12540
567340,23307,SET OF 60 PANTRY DESIGN CAKE CASES,24.0,9/19/11 15:02,0.55,12540
567340,23306,SET OF 36 DOILIES PANTRY DESIGN,12.0,9/19/11 15:02,1.45,12540
567340,21210,SET OF 72 RETROSPOT PAPER  DOILIES,12.0,9/19/11 15:02,1.45,12540
567340,21671,RED SPOT CERAMIC DRAWER KNOB,12.0,9/19/11 15:02,1.45,12540
567340,21668,RED STRIPE CERAMIC DRAWER KNOB,12.0,9/19/11 15:02,1.45,12540
567340,21669,BLUE STRIPE CERAMIC DRAWER KNOB,12.0,9/19/11 15:02,1.45,12540
567340,21672,WHITE SPOT RED CERAMIC DRAWER KNOB,12.0,9/19/11 15:02,1.45,12540
567340,21673,WHITE SPOT BLUE CERAMIC DRAWER KNOB,12.0,9/19/11 15:02,1.45,12540
567340,21670,BLUE SPOT CERAMIC DRAWER KNOB,12.0,9/19/11 15:02,1.45,12540
567340,22077,6 RIBBONS RUSTIC CHARM,12.0,9/19/11 15:02,1.95,12540
567340,22984,CARD GINGHAM ROSE,12.0,9/19/11 15:02,0.42,12540
567340,21770,OPEN CLOSED METAL SIGN,8.0,9/19/11 15:02,4.95,12540
567340,21172,PARTY METAL SIGN,12.0,9/19/11 15:02,1.45,12540
567340,22176,BLUE OWL SOFT TOY,12.0,9/19/11 15:02,2.95,12540
567340,23393,HOME SWEET HOME CUSHION COVER,8.0,9/19/11 15:02,3.75,12540
567340,23432,PRETTY HANGING QUILTED HEARTS,36.0,9/19/11 15:02,0.83,12540
567340,23433,HANGING QUILTED PATCHWORK APPLES,24.0,9/19/11 15:02,0.83,12540
567340,23445,ICE CREAM BUBBLES,20.0,9/19/11 15:02,0.83,12540
567340,84828,JUNGLE POPSICLES ICE LOLLY MOULDS,12.0,9/19/11 15:02,1.25,12540
567340,21164,HOME SWEET HOME METAL SIGN,6.0,9/19/11 15:02,2.95,12540
567340,21754,HOME BUILDING BLOCK WORD,9.0,9/19/11 15:02,6.25,12540
567340,22585,PACK OF 6 BIRDY GIFT TAGS,24.0,9/19/11 15:02,1.25,12540
567340,23240,SET OF 4 KNICK KNACK TINS DOILY,12.0,9/19/11 15:02,4.15,12540
567340,84879,ASSORTED COLOUR BIRD ORNAMENT,48.0,9/19/11 15:02,1.69,12540
567340,,POSTAGE,4.0,9/19/11 15:02,28.0,12540
,22486,PLASMATRONIC LAMP,-1.0,9/20/11 16:33,12.75,12540
,22423,REGENCY CAKESTAND 3 TIER,-1.0,9/20/11 16:33,12.75,12540
567653,23203,JUMBO BAG VINTAGE DOILY,10.0,9/21/11 14:35,2.08,12550
567653,20712,JUMBO BAG WOODLAND ANIMALS,10.0,9/21/11 14:35,2.08,12550
567653,22661,CHARLOTTE BAG DOLLY GIRL DESIGN,10.0,9/21/11 14:35,0.85,12550
567653,,FAIRY CAKE DESIGN UMBRELLA,4.0,9/21/11 14:35,3.75,12550
567653,,RED RETROSPOT UMBRELLA,3.0,9/21/11 14:35,5.95,12550
567653,,EDWARDIAN PARASOL NATURAL,3.0,9/21/11 14:35,5.95,12550
567653,22497,SET OF 2 TINS VINTAGE BATHROOM,4.0,9/21/11 14:35,4.25,12550
567653,37495,FAIRY CAKE BIRTHDAY CANDLE SET,4.0,9/21/11 14:35,3.75,12550
567653,,PINK LOVE BIRD CANDLE,12.0,9/21/11 14:35,1.25,12550
567653,22037,ROBOT BIRTHDAY CARD,12.0,9/21/11 14:35,0.42,12550
567653,22712,CARD DOLLY GIRL,12.0,9/21/11 14:35,0.42,12550
567653,22983,CARD BILLBOARD FONT,12.0,9/21/11 14:35,0.42,12550
567653,22815,CARD PSYCHEDELIC APPLES,12.0,9/21/11 14:35,0.42,12550
567653,,WRAP ENGLISH ROSE,25.0,9/21/11 14:35,0.42,12550
567653,23231,WRAP  VINTAGE DOILY,25.0,9/21/11 14:35,0.42,12550
567653,22708,WRAP DOLLY GIRL,25.0,9/21/11 14:35,0.42,12550
567653,21523,DOORMAT FANCY FONT HOME SWEET HOME,2.0,9/21/11 14:35,8.25,12550
567653,48184,DOORMAT ENGLISH ROSE,4.0,9/21/11 14:35,8.25,12550
567653,21524,DOORMAT SPOTTY HOME SWEET HOME,2.0,9/21/11 14:35,8.25,12550
567653,22487,WHITE WOOD GARDEN PLANT LADDER,1.0,9/21/11 14:35,9.95,12550
567653,22960,JAM MAKING SET WITH JARS,6.0,9/21/11 14:35,4.25,12550
567653,22961,JAM MAKING SET PRINTED,12.0,9/21/11 14:35,1.45,12550
567653,22652,TRAVEL SEWING KIT,10.0,9/21/11 14:35,1.65,12550
567653,85178,VICTORIAN SEWING KIT,12.0,9/21/11 14:35,1.25,12550
567653,22077,6 RIBBONS RUSTIC CHARM,12.0,9/21/11 14:35,1.95,12550
567653,47566,PARTY BUNTING,4.0,9/21/11 14:35,4.95,12550
567653,23298,SPOTTY BUNTING,3.0,9/21/11 14:35,4.95,12550
567653,22668,PINK BABY BUNTING,5.0,9/21/11 14:35,2.95,12550
567653,21172,PARTY METAL SIGN,12.0,9/21/11 14:35,1.45,12550
567653,22212,FOUR HOOK  WHITE LOVEBIRDS,6.0,9/21/11 14:35,2.1,12550
567653,,TEA TIME KITCHEN APRON,3.0,9/21/11 14:35,5.95,12550
567653,21625,VINTAGE UNION JACK APRON,3.0,9/21/11 14:35,6.95,12550
567653,22326,ROUND SNACK BOXES SET OF4 WOODLAND,6.0,9/21/11 14:35,2.95,12550
567653,22630,DOLLY GIRL LUNCH BOX,12.0,9/21/11 14:35,1.95,12550
567653,22384,LUNCH BAG PINK POLKADOT,10.0,9/21/11 14:35,1.65,12550
567653,21559,STRAWBERRY LUNCH BOX WITH CUTLERY,6.0,9/21/11 14:35,2.55,12550
567653,22631,CIRCUS PARADE LUNCH BOX,12.0,9/21/11 14:35,1.95,12550
567653,23243,SET OF TEA COFFEE SUGAR TINS PANTRY,4.0,9/21/11 14:35,4.95,12550
567653,23198,PANTRY MAGNETIC  SHOPPING LIST,12.0,9/21/11 14:35,1.45,12550
567653,23293,SET OF 12 FAIRY CAKE BAKING CASES,8.0,9/21/11 14:35,0.83,12550
567653,23296,SET OF 6 TEA TIME BAKING CASES,8.0,9/21/11 14:35,1.25,12550
567653,21090,SET/6 COLLAGE PAPER PLATES,12.0,9/21/11 14:35,0.39,12550
567653,21084,SET/6 COLLAGE PAPER CUPS,24.0,9/21/11 14:35,0.19,12550
567653,84988,SET OF 72 PINK HEART PAPER DOILIES,12.0,9/21/11 14:35,1.45,12550
567653,21210,SET OF 72 RETROSPOT PAPER  DOILIES,12.0,9/21/11 14:35,1.45,12550
567653,23108,SET OF 10 LED DOLLY LIGHTS,2.0,9/21/11 14:35,6.25,12550
567653,22554,PLASTERS IN TIN WOODLAND ANIMALS,12.0,9/21/11 14:35,1.65,12550
567653,22555,PLASTERS IN TIN STRONGMAN,12.0,9/21/11 14:35,1.65,12550
567653,21981,PACK OF 12 WOODLAND TISSUES,24.0,9/21/11 14:35,0.39,12550
567653,21984,PACK OF 12 PINK PAISLEY TISSUES,24.0,9/21/11 14:35,0.39,12550
567653,22389,PAPERWEIGHT SAVE THE PLANET,6.0,9/21/11 14:35,2.55,12550
567653,22390,PAPERWEIGHT CHILDHOOD MEMORIES,6.0,9/21/11 14:35,2.55,12550
567653,22398,MAGNETS PACK OF 4 SWALLOWS,12.0,9/21/11 14:35,0.39,12550
567653,,ENVELOPE 50 BLOSSOM IMAGES,12.0,9/21/11 14:35,0.42,12550
567653,21880,RED RETROSPOT TAPE,12.0,9/21/11 14:35,0.65,12550
567653,,POSTAGE,5.0,9/21/11 14:35,28.0,12550
567653,,PINK NEW BAROQUECANDLESTICK CANDLE,24.0,9/21/11 14:35,0.85,12550
567968,22142,CHRISTMAS CRAFT WHITE FAIRY,12.0,9/23/11 9:44,1.45,12546
567968,22573,STAR WOODEN CHRISTMAS DECORATION,12.0,9/23/11 9:44,0.85,12546
567968,22578,WOODEN STAR CHRISTMAS SCANDINAVIAN,12.0,9/23/11 9:44,0.85,12546
567968,22579,WOODEN TREE CHRISTMAS SCANDINAVIAN,12.0,9/23/11 9:44,0.85,12546
