536971,21733,RED HANGING HEART T-LIGHT HOLDER,32.0,12/3/10 13:40,2.55,12779
536971,21232,STRAWBERRY CERAMIC TRINKET BOX,24.0,12/3/10 13:40,1.25,12779
536971,37446,MINI CAKE STAND WITH HANGING CAKES,8.0,12/3/10 13:40,1.45,12779
536971,37448,CERAMIC CAKE DESIGN SPOTTED MUG,24.0,12/3/10 13:40,1.49,12779
536971,21700,BIG DOUGHNUT FRIDGE MAGNETS,24.0,12/3/10 13:40,0.85,12779
536971,22844,VINTAGE CREAM DOG FOOD CONTAINER,4.0,12/3/10 13:40,8.5,12779
536971,22961,JAM MAKING SET PRINTED,12.0,12/3/10 13:40,1.45,12779
536971,22969,HOMEMADE JAM SCENTED CANDLES,12.0,12/3/10 13:40,1.45,12779
541267,22063,CERAMIC BOWL WITH STRAWBERRY DESIGN,6.0,1/17/11 10:37,2.95,12779
541267,22624,IVORY KITCHEN SCALES,2.0,1/17/11 10:37,8.5,12779
541267,22626,BLACK KITCHEN SCALES,2.0,1/17/11 10:37,8.5,12779
541267,22845,VINTAGE CREAM CAT FOOD CONTAINER,2.0,1/17/11 10:37,6.35,12779
541267,22178,VICTORIAN GLASS HANGING T-LIGHT,12.0,1/17/11 10:37,1.25,12779
541267,37450,CERAMIC CAKE BOWL + HANGING CAKES,6.0,1/17/11 10:37,2.95,12779
541267,22510,GINGHAM BABUSHKA DOORSTOP,8.0,1/17/11 10:37,1.25,12779
541267,22195,LARGE HEART MEASURING SPOONS,12.0,1/17/11 10:37,1.65,12779
541267,22503,CABIN BAG VINTAGE PAISLEY,3.0,1/17/11 10:37,12.75,12779
541267,84917,WHITE HAND TOWEL WITH BUTTERFLY,20.0,1/17/11 10:37,1.25,12779
541267,84915,HAND TOWEL PINK FLOWER AND DAISY,10.0,1/17/11 10:37,1.25,12779
541267,,METAL SIGN CUPCAKE SINGLE HOOK,20.0,1/17/11 10:37,0.42,12779
541267,22782,SET 3 WICKER STORAGE BASKETS,8.0,1/17/11 10:37,9.95,12779
541267,22783,SET 3 WICKER OVAL BASKETS W LIDS,8.0,1/17/11 10:37,7.95,12779
541267,20803,SMALL PINK GLASS SUNDAE DISH,36.0,1/17/11 10:37,0.42,12779
541267,20801,LARGE PINK GLASS SUNDAE DISH,16.0,1/17/11 10:37,0.75,12779
541267,21110,LARGE CAKE TOWEL PINK SPOTS,24.0,1/17/11 10:37,1.95,12779
541267,22720,SET OF 3 CAKE TINS PANTRY DESIGN,3.0,1/17/11 10:37,4.95,12779
541267,22722,SET OF 6 SPICE TINS PANTRY DESIGN,4.0,1/17/11 10:37,3.95,12779
541267,22666,RECIPE BOX PANTRY YELLOW DESIGN,12.0,1/17/11 10:37,2.95,12779
541267,22961,JAM MAKING SET PRINTED,36.0,1/17/11 10:37,1.45,12779
541267,22969,HOMEMADE JAM SCENTED CANDLES,12.0,1/17/11 10:37,1.45,12779
541267,22646,CERAMIC STRAWBERRY CAKE MONEY BANK,12.0,1/17/11 10:37,1.45,12779
541267,22171,3 HOOK PHOTO SHELF ANTIQUE WHITE,2.0,1/17/11 10:37,8.5,12779
541267,21232,STRAWBERRY CERAMIC TRINKET BOX,12.0,1/17/11 10:37,1.25,12779
543214,22720,SET OF 3 CAKE TINS PANTRY DESIGN,24.0,2/4/11 13:19,4.25,12779
543214,22722,SET OF 6 SPICE TINS PANTRY DESIGN,24.0,2/4/11 13:19,3.45,12779
543214,22173,METAL 4 HOOK HANGER FRENCH CHATEAU,8.0,2/4/11 13:19,2.95,12779
543214,22845,VINTAGE CREAM CAT FOOD CONTAINER,4.0,2/4/11 13:19,6.35,12779
543214,22169,FAMILY ALBUM WHITE PICTURE FRAME,2.0,2/4/11 13:19,8.5,12779
543214,22690,DOORMAT HOME SWEET HOME BLUE,2.0,2/4/11 13:19,7.95,12779
543214,20726,LUNCH BAG WOODLAND,10.0,2/4/11 13:19,1.65,12779
543214,21232,STRAWBERRY CERAMIC TRINKET BOX,12.0,2/4/11 13:19,1.25,12779
543214,22989,SET 2 PANTRY DESIGN TEA TOWELS,12.0,2/4/11 13:19,3.25,12779
543411,22480,RED TEA TOWEL CLASSIC DESIGN,12.0,2/8/11 11:31,1.25,12576
543411,21868,POTTING SHED TEA MUG,12.0,2/8/11 11:31,1.25,12576
543411,21896,POTTING SHED TWINE,6.0,2/8/11 11:31,2.1,12576
543411,,SINGLE HEART ZINC T-LIGHT HOLDER,12.0,2/8/11 11:31,0.95,12576
543411,84832,ZINC WILLIE WINKIE  CANDLE STICK,12.0,2/8/11 11:31,0.85,12576
543411,82583,HOT BATHS METAL SIGN,12.0,2/8/11 11:31,2.1,12576
543411,82578,KITCHEN METAL SIGN,12.0,2/8/11 11:31,0.55,12576
543411,22567,20 DOLLY PEGS RETROSPOT,12.0,2/8/11 11:31,1.25,12576
543411,84378,SET OF 3 HEART COOKIE CUTTERS,12.0,2/8/11 11:31,1.25,12576
543411,84380,SET OF 3 BUTTERFLY COOKIE CUTTERS,12.0,2/8/11 11:31,1.25,12576
543411,22759,SET OF 3 NOTEBOOKS IN PARCEL,12.0,2/8/11 11:31,1.65,12576
543411,22668,PINK BABY BUNTING,5.0,2/8/11 11:31,2.95,12576
543411,22188,BLACK HEART CARD HOLDER,4.0,2/8/11 11:31,3.95,12576
543411,22342,HOME GARLAND PAINTED ZINC,12.0,2/8/11 11:31,1.65,12576
543411,22920,HERB MARKER BASIL,12.0,2/8/11 11:31,0.65,12576
543411,22918,HERB MARKER PARSLEY,12.0,2/8/11 11:31,0.65,12576
543411,,PINK PARTY BAGS,6.0,2/8/11 11:31,2.1,12576
543411,22482,BLUE TEA TOWEL CLASSIC DESIGN,12.0,2/8/11 11:31,1.25,12576
543411,22053,EMPIRE DESIGN ROSETTE,10.0,2/8/11 11:31,1.25,12576
546642,22993,SET OF 4 PANTRY JELLY MOULDS,24.0,3/15/11 13:13,1.25,12779
546642,22666,RECIPE BOX PANTRY YELLOW DESIGN,24.0,3/15/11 13:13,2.55,12779
546642,21232,STRAWBERRY CERAMIC TRINKET BOX,24.0,3/15/11 13:13,1.25,12779
546642,22057,CERAMIC PLATE STRAWBERRY DESIGN,24.0,3/15/11 13:13,1.49,12779
546642,22059,CERAMIC STRAWBERRY DESIGN MUG,24.0,3/15/11 13:13,1.49,12779
546642,22061,LARGE CAKE STAND  HANGING STRAWBERY,2.0,3/15/11 13:13,9.95,12779
546642,37450,CERAMIC CAKE BOWL + HANGING CAKES,12.0,3/15/11 13:13,2.95,12779
546642,37448,CERAMIC CAKE DESIGN SPOTTED MUG,24.0,3/15/11 13:13,1.49,12779
546642,22626,BLACK KITCHEN SCALES,4.0,3/15/11 13:13,8.5,12779
,22993,SET OF 4 PANTRY JELLY MOULDS,-2.0,3/21/11 12:20,1.25,12779
,37450,CERAMIC CAKE BOWL + HANGING CAKES,-1.0,3/21/11 12:20,2.95,12779
,37448,CERAMIC CAKE DESIGN SPOTTED MUG,-6.0,3/21/11 12:20,1.49,12779
548909,22978,PANTRY ROLLING PIN,6.0,4/5/11 8:43,3.75,12779
548909,22979,PANTRY WASHING UP BRUSH,12.0,4/5/11 8:43,1.45,12779
548909,22649,STRAWBERRY FAIRY CAKE TEAPOT,8.0,4/5/11 8:43,4.95,12779
548909,22254,FELT TOADSTOOL LARGE,24.0,4/5/11 8:43,1.25,12779
548909,22255,FELT TOADSTOOL  SMALL,24.0,4/5/11 8:43,0.85,12779
548909,22264,FELT FARM ANIMAL WHITE BUNNY,24.0,4/5/11 8:43,0.85,12779
548909,22321,BIRD DECORATION RED RETROSPOT,24.0,4/5/11 8:43,0.85,12779
548909,22322,BIRD DECORATION GREEN POLKADOT,24.0,4/5/11 8:43,0.85,12779
548909,22646,CERAMIC STRAWBERRY CAKE MONEY BANK,12.0,4/5/11 8:43,1.45,12779
548909,21232,STRAWBERRY CERAMIC TRINKET BOX,72.0,4/5/11 8:43,1.06,12779
548909,37446,MINI CAKE STAND WITH HANGING CAKES,16.0,4/5/11 8:43,1.45,12779
548909,37447,CERAMIC CAKE DESIGN SPOTTED PLATE,24.0,4/5/11 8:43,1.49,12779
548909,37450,CERAMIC CAKE BOWL + HANGING CAKES,6.0,4/5/11 8:43,2.95,12779
548909,37448,CERAMIC CAKE DESIGN SPOTTED MUG,48.0,4/5/11 8:43,1.25,12779
548909,37449,CERAMIC CAKE STAND + HANGING CAKES,2.0,4/5/11 8:43,9.95,12779
548909,,TEA TIME OVEN GLOVE,10.0,4/5/11 8:43,1.25,12779
548909,22059,CERAMIC STRAWBERRY DESIGN MUG,24.0,4/5/11 8:43,1.49,12779
548909,22055,MINI CAKE STAND  HANGING STRAWBERY,16.0,4/5/11 8:43,1.65,12779
548909,22061,LARGE CAKE STAND  HANGING STRAWBERY,4.0,4/5/11 8:43,9.95,12779
548909,22063,CERAMIC BOWL WITH STRAWBERRY DESIGN,6.0,4/5/11 8:43,2.95,12779
548909,22195,LARGE HEART MEASURING SPOONS,24.0,4/5/11 8:43,1.65,12779
548909,22844,VINTAGE CREAM DOG FOOD CONTAINER,4.0,4/5/11 8:43,8.5,12779
548909,22845,VINTAGE CREAM CAT FOOD CONTAINER,4.0,4/5/11 8:43,6.35,12779
548909,22690,DOORMAT HOME SWEET HOME BLUE,2.0,4/5/11 8:43,7.95,12779
548909,22969,HOMEMADE JAM SCENTED CANDLES,12.0,4/5/11 8:43,1.45,12779
551988,16016,LARGE CHINESE STYLE SCISSOR,10.0,5/5/11 15:08,0.85,12576
551988,16014,SMALL CHINESE STYLE SCISSOR,20.0,5/5/11 15:08,0.42,12576
551988,22478,BIRDHOUSE GARDEN MARKER,10.0,5/5/11 15:08,1.25,12576
551988,22684,FRENCH BLUE METAL DOOR SIGN 9,10.0,5/5/11 15:08,1.25,12576
551988,22686,FRENCH BLUE METAL DOOR SIGN No,12.0,5/5/11 15:08,1.25,12576
551988,22673,FRENCH GARDEN SIGN BLUE METAL,12.0,5/5/11 15:08,1.25,12576
551988,22671,FRENCH LAUNDRY SIGN BLUE METAL,12.0,5/5/11 15:08,1.65,12576
551988,22982,PANTRY PASTRY BRUSH,12.0,5/5/11 15:08,1.25,12576
551988,22722,SET OF 6 SPICE TINS PANTRY DESIGN,4.0,5/5/11 15:08,3.95,12576
551988,20718,RED RETROSPOT SHOPPER BAG,10.0,5/5/11 15:08,1.25,12576
551988,21216,"SET 3 RETROSPOT TEA,COFFEE,SUGAR",4.0,5/5/11 15:08,4.95,12576
554651,22690,DOORMAT HOME SWEET HOME BLUE,4.0,5/25/11 12:55,7.95,12779
554651,23148,MINIATURE ANTIQUE ROSE HOOK IVORY,12.0,5/25/11 12:55,0.83,12779
554651,22993,SET OF 4 PANTRY JELLY MOULDS,24.0,5/25/11 12:55,1.25,12779
554651,22961,JAM MAKING SET PRINTED,48.0,5/25/11 12:55,1.45,12779
554651,23299,FOOD COVER WITH BEADS SET 2,12.0,5/25/11 12:55,3.75,12779
554651,20712,JUMBO BAG WOODLAND ANIMALS,10.0,5/25/11 12:55,2.08,12779
554651,21929,JUMBO BAG PINK VINTAGE PAISLEY,10.0,5/25/11 12:55,2.08,12779
554651,22554,PLASTERS IN TIN WOODLAND ANIMALS,12.0,5/25/11 12:55,1.65,12779
554651,22557,PLASTERS IN TIN VINTAGE PAISLEY,12.0,5/25/11 12:55,1.65,12779
554651,22553,PLASTERS IN TIN SKULLS,12.0,5/25/11 12:55,1.65,12779
554651,,PINK FAIRY CAKE CHILDRENS APRON,8.0,5/25/11 12:55,1.95,12779
554651,23108,SET OF 10 LED DOLLY LIGHTS,4.0,5/25/11 12:55,6.25,12779
554651,22173,METAL 4 HOOK HANGER FRENCH CHATEAU,16.0,5/25/11 12:55,2.95,12779
554651,22278,OVERNIGHT BAG VINTAGE ROSE PAISLEY,3.0,5/25/11 12:55,4.95,12779
554651,22061,LARGE CAKE STAND  HANGING STRAWBERY,4.0,5/25/11 12:55,9.95,12779
554651,37449,CERAMIC CAKE STAND + HANGING CAKES,4.0,5/25/11 12:55,9.95,12779
554651,22907,PACK OF 20 NAPKINS PANTRY DESIGN,24.0,5/25/11 12:55,0.85,12779
554651,22624,IVORY KITCHEN SCALES,4.0,5/25/11 12:55,8.5,12779
554651,22627,MINT KITCHEN SCALES,2.0,5/25/11 12:55,8.5,12779
554651,22625,RED KITCHEN SCALES,2.0,5/25/11 12:55,8.5,12779
554651,22979,PANTRY WASHING UP BRUSH,12.0,5/25/11 12:55,1.45,12779
554651,22795,SWEETHEART RECIPE BOOK STAND,2.0,5/25/11 12:55,6.75,12779
554651,22796,PHOTO FRAME 3 CLASSIC HANGING,4.0,5/25/11 12:55,9.95,12779
554651,23110,PARISIENNE KEY CABINET,2.0,5/25/11 12:55,5.75,12779
554651,22169,FAMILY ALBUM WHITE PICTURE FRAME,6.0,5/25/11 12:55,8.5,12779
554651,22170,PICTURE FRAME WOOD TRIPLE PORTRAIT,4.0,5/25/11 12:55,6.75,12779
554651,22171,3 HOOK PHOTO SHELF ANTIQUE WHITE,4.0,5/25/11 12:55,8.5,12779
554654,,EDWARDIAN PARASOL BLACK,3.0,5/25/11 13:34,5.95,12815
554654,,EDWARDIAN PARASOL NATURAL,3.0,5/25/11 13:34,5.95,12815
554654,22617,BAKING SET SPACEBOY DESIGN,3.0,5/25/11 13:34,4.95,12815
554654,22138,BAKING SET 9 PIECE RETROSPOT,3.0,5/25/11 13:34,4.95,12815
554654,22745,POPPY'S PLAYHOUSE BEDROOM,6.0,5/25/11 13:34,2.1,12815
554654,22748,POPPY'S PLAYHOUSE KITCHEN,6.0,5/25/11 13:34,2.1,12815
554654,22746,POPPY'S PLAYHOUSE LIVINGROOM,6.0,5/25/11 13:34,2.1,12815
554654,21890,S/6 WOODEN SKITTLES IN COTTON BAG,6.0,5/25/11 13:34,3.25,12815
554654,21891,TRADITIONAL WOODEN SKIPPING ROPE,12.0,5/25/11 13:34,1.45,12815
554654,21896,POTTING SHED TWINE,6.0,5/25/11 13:34,2.1,12815
554654,22960,JAM MAKING SET WITH JARS,6.0,5/25/11 13:34,4.25,12815
554654,22961,JAM MAKING SET PRINTED,12.0,5/25/11 13:34,1.45,12815
554654,22962,JAM JAR WITH PINK LID,12.0,5/25/11 13:34,0.85,12815
554654,22963,JAM JAR WITH GREEN LID,12.0,5/25/11 13:34,0.85,12815
554654,22980,PANTRY SCRUBBING BRUSH,12.0,5/25/11 13:34,1.65,12815
554654,22979,PANTRY WASHING UP BRUSH,12.0,5/25/11 13:34,1.45,12815
554654,,SET OF 16 VINTAGE ROSE CUTLERY,2.0,5/25/11 13:34,12.75,12815
554654,,SET OF 16 VINTAGE SKY BLUE CUTLERY,2.0,5/25/11 13:34,12.75,12815
554654,,SET OF 16 VINTAGE PISTACHIO CUTLERY,2.0,5/25/11 13:34,12.75,12815
554654,84969,BOX OF 6 ASSORTED COLOUR TEASPOONS,6.0,5/25/11 13:34,4.25,12815
554654,21868,POTTING SHED TEA MUG,12.0,5/25/11 13:34,1.25,12815
554654,,CHERRY BLOSSOM DECORATIVE FLASK,4.0,5/25/11 13:34,3.75,12815
554654,16014,SMALL CHINESE STYLE SCISSOR,20.0,5/25/11 13:34,0.42,12815
554654,16016,LARGE CHINESE STYLE SCISSOR,10.0,5/25/11 13:34,0.85,12815
554654,22312,OFFICE MUG WARMER POLKADOT,6.0,5/25/11 13:34,2.95,12815
554654,23165,LARGE CERAMIC TOP STORAGE JAR,12.0,5/25/11 13:34,1.65,12815
554654,23166,MEDIUM CERAMIC TOP STORAGE JAR,12.0,5/25/11 13:34,1.25,12815
554654,23167,SMALL CERAMIC TOP STORAGE JAR,12.0,5/25/11 13:34,0.83,12815
554654,22722,SET OF 6 SPICE TINS PANTRY DESIGN,4.0,5/25/11 13:34,3.95,12815
554654,22993,SET OF 4 PANTRY JELLY MOULDS,12.0,5/25/11 13:34,1.25,12815
554654,,POSTAGE,3.0,5/25/11 13:34,40.0,12815
,22796,PHOTO FRAME 3 CLASSIC HANGING,-4.0,6/1/11 14:11,9.95,12779
,22061,LARGE CAKE STAND  HANGING STRAWBERY,-1.0,6/1/11 14:11,9.95,12779
,21929,JUMBO BAG PINK VINTAGE PAISLEY,-2.0,6/1/11 14:11,2.08,12779
,23108,SET OF 10 LED DOLLY LIGHTS,-4.0,6/3/11 10:36,6.25,12779
555422,23108,SET OF 10 LED DOLLY LIGHTS,4.0,6/3/11 10:37,6.25,12779
557027,21288,STRIPEY CHOCOLATE NESTING BOXES,6.0,6/16/11 13:24,2.95,12816
557027,,SET/4 WHITE RETRO STORAGE CUBES,1.0,6/16/11 13:24,39.95,12816
557027,21896,POTTING SHED TWINE,6.0,6/16/11 13:24,2.1,12816
557027,22652,TRAVEL SEWING KIT,10.0,6/16/11 13:24,1.65,12816
557027,22960,JAM MAKING SET WITH JARS,6.0,6/16/11 13:24,4.25,12816
557027,22781,GUMBALL MAGAZINE RACK,2.0,6/16/11 13:24,7.65,12816
557027,22191,IVORY DINER WALL CLOCK,2.0,6/16/11 13:24,8.5,12816
557027,22467,GUMBALL COAT RACK,6.0,6/16/11 13:24,2.55,12816
557027,21770,OPEN CLOSED METAL SIGN,2.0,6/16/11 13:24,4.95,12816
557027,22962,JAM JAR WITH PINK LID,12.0,6/16/11 13:24,0.85,12816
557027,22845,VINTAGE CREAM CAT FOOD CONTAINER,2.0,6/16/11 13:24,6.35,12816
557027,22666,RECIPE BOX PANTRY YELLOW DESIGN,6.0,6/16/11 13:24,2.95,12816
557027,16016,LARGE CHINESE STYLE SCISSOR,10.0,6/16/11 13:24,0.85,12816
557027,,POSTAGE,2.0,6/16/11 13:24,40.0,12816
557027,23243,SET OF TEA COFFEE SUGAR TINS PANTRY,4.0,6/16/11 13:24,4.95,12816
559834,22863,SOAP DISH BROCANTE,8.0,7/13/11 10:02,2.95,12576
559834,,SINGLE HEART ZINC T-LIGHT HOLDER,12.0,7/13/11 10:02,0.95,12576
559834,22567,20 DOLLY PEGS RETROSPOT,12.0,7/13/11 10:02,1.45,12576
559834,22666,RECIPE BOX PANTRY YELLOW DESIGN,6.0,7/13/11 10:02,2.95,12576
559834,21154,RED RETROSPOT OVEN GLOVE,10.0,7/13/11 10:02,1.25,12576
559834,,TEA TIME OVEN GLOVE,10.0,7/13/11 10:02,1.25,12576
559834,23243,SET OF TEA COFFEE SUGAR TINS PANTRY,4.0,7/13/11 10:02,4.95,12576
559834,22445,PENCIL CASE LIFE IS BEAUTIFUL,6.0,7/13/11 10:02,2.95,12576
559834,20839,FRENCH PAISLEY CUSHION COVER,12.0,7/13/11 10:02,0.85,12576
559834,16016,LARGE CHINESE STYLE SCISSOR,10.0,7/13/11 10:02,0.85,12576
559834,16014,SMALL CHINESE STYLE SCISSOR,20.0,7/13/11 10:02,0.42,12576
559834,22469,HEART OF WICKER SMALL,12.0,7/13/11 10:02,1.65,12576
559834,22762,CUPBOARD 3 DRAWER MA CAMPAGNE,1.0,7/13/11 10:02,14.95,12576
559834,22675,FRENCH KITCHEN SIGN BLUE METAL,12.0,7/13/11 10:02,1.25,12576
559834,22672,FRENCH BATHROOM SIGN BLUE METAL,12.0,7/13/11 10:02,1.65,12576
559834,22487,WHITE WOOD GARDEN PLANT LADDER,1.0,7/13/11 10:02,9.95,12576
560119,23198,PANTRY MAGNETIC  SHOPPING LIST,12.0,7/15/11 10:21,1.45,12815
560119,23243,SET OF TEA COFFEE SUGAR TINS PANTRY,8.0,7/15/11 10:21,4.95,12815
560119,23240,SET OF 4 KNICK KNACK TINS DOILEY,6.0,7/15/11 10:21,4.15,12815
560119,,EDWARDIAN PARASOL NATURAL,6.0,7/15/11 10:21,5.95,12815
560119,,EDWARDIAN PARASOL BLACK,6.0,7/15/11 10:21,5.95,12815
560119,22960,JAM MAKING SET WITH JARS,6.0,7/15/11 10:21,4.25,12815
560119,22989,SET 2 PANTRY DESIGN TEA TOWELS,6.0,7/15/11 10:21,3.25,12815
560119,22720,SET OF 3 CAKE TINS PANTRY DESIGN,6.0,7/15/11 10:21,4.95,12815
560119,22979,PANTRY WASHING UP BRUSH,12.0,7/15/11 10:21,1.45,12815
560119,23051,RECYCLED ACAPULCO MAT BLUE,2.0,7/15/11 10:21,8.25,12815
560119,,SET OF 16 VINTAGE SKY BLUE CUTLERY,2.0,7/15/11 10:21,12.75,12815
560119,16014,SMALL CHINESE STYLE SCISSOR,20.0,7/15/11 10:21,0.42,12815
560119,16016,LARGE CHINESE STYLE SCISSOR,30.0,7/15/11 10:21,0.85,12815
560119,85048,15CM CHRISTMAS GLASS BALL 20 LIGHTS,4.0,7/15/11 10:21,7.95,12815
560119,23166,MEDIUM CERAMIC TOP STORAGE JAR,12.0,7/15/11 10:21,1.25,12815
560119,,POSTAGE,2.0,7/15/11 10:21,40.0,12815
,22666,RECIPE BOX PANTRY YELLOW DESIGN,-3.0,7/25/11 11:36,2.95,12576
562130,22728,ALARM CLOCK BAKELIKE PINK,4.0,8/3/11 9:13,3.75,12750
562130,22627,MINT KITCHEN SCALES,2.0,8/3/11 9:13,8.5,12750
562130,22624,IVORY KITCHEN SCALES,2.0,8/3/11 9:13,8.5,12750
562130,,CHERRY BLOSSOM  DECORATIVE FLASK,12.0,8/3/11 9:13,3.39,12750
562130,22620,4 TRADITIONAL SPINNING TOPS,12.0,8/3/11 9:13,1.45,12750
562130,23052,RECYCLED ACAPULCO MAT TURQUOISE,2.0,8/3/11 9:13,8.25,12750
562130,23053,RECYCLED ACAPULCO MAT PINK,2.0,8/3/11 9:13,8.25,12750
562130,22622,BOX OF VINTAGE ALPHABET BLOCKS,2.0,8/3/11 9:13,11.95,12750
562130,23240,SET OF 4 KNICK KNACK TINS DOILEY,6.0,8/3/11 9:13,4.15,12750
562130,23238,SET OF 4 KNICK KNACK TINS LONDON,6.0,8/3/11 9:13,4.15,12750
562130,22898,CHILDRENS APRON APPLES DESIGN,8.0,8/3/11 9:13,1.95,12750
562130,22726,ALARM CLOCK BAKELIKE GREEN,4.0,8/3/11 9:13,3.75,12750
562130,,WRAP SUKI AND FRIENDS,25.0,8/3/11 9:13,0.42,12750
562130,23231,WRAP DOILEY DESIGN,25.0,8/3/11 9:13,0.42,12750
562130,22710,WRAP I LOVE LONDON,25.0,8/3/11 9:13,0.42,12750
