564819,23084,RABBIT NIGHT LIGHT,48.0,8/30/11 12:11,1.79,12814
564819,,POSTAGE,1.0,8/30/11 12:11,40.0,12814
565470,35970,ZINC FOLKART SLEIGH BELLS,12.0,9/5/11 10:06,1.69,12576
565470,23263,SET OF 3 WOODEN HEART DECORATIONS,12.0,9/5/11 10:06,1.25,12576
565470,23264,SET OF 3 WOODEN SLEIGH DECORATIONS,12.0,9/5/11 10:06,1.25,12576
565470,23265,SET OF 3 WOODEN TREE DECORATIONS,12.0,9/5/11 10:06,1.25,12576
565470,23266,SET OF 3 WOODEN STOCKING DECORATION,12.0,9/5/11 10:06,1.25,12576
565470,21277,FRENCH STYLE EMBOSSED HEART CABINET,1.0,9/5/11 10:06,21.95,12576
565470,22761,CHEST 7 DRAWER MA CAMPAGNE,1.0,9/5/11 10:06,24.95,12576
565470,23198,PANTRY MAGNETIC  SHOPPING LIST,24.0,9/5/11 10:06,1.45,12576
565470,16016,LARGE CHINESE STYLE SCISSOR,20.0,9/5/11 10:06,0.85,12576
565470,23145,ZINC T-LIGHT HOLDER STAR LARGE,12.0,9/5/11 10:06,0.95,12576
565470,22077,6 RIBBONS RUSTIC CHARM,12.0,9/5/11 10:06,1.65,12576
565470,22567,20 DOLLY PEGS RETROSPOT,12.0,9/5/11 10:06,1.45,12576
565470,,ENAMEL PINK COFFEE CONTAINER,12.0,9/5/11 10:06,0.83,12576
565470,22342,HOME GARLAND PAINTED ZINC,24.0,9/5/11 10:06,0.75,12576
565470,20836,FRENCH PAISLEY CUSHION COVER,12.0,9/5/11 10:06,0.83,12576
565470,20839,FRENCH PAISLEY CUSHION COVER,12.0,9/5/11 10:06,0.85,12576
565583,,EDWARDIAN PARASOL BLACK,3.0,9/5/11 12:41,5.95,12816
565583,22377,BOTTLE BAG RETROSPOT,5.0,9/5/11 12:41,2.1,12816
565583,22173,METAL 4 HOOK HANGER FRENCH CHATEAU,8.0,9/5/11 12:41,2.95,12816
565583,22781,GUMBALL MAGAZINE RACK,2.0,9/5/11 12:41,7.65,12816
565583,22847,BREAD BIN DINER STYLE IVORY,1.0,9/5/11 12:41,16.95,12816
565583,22624,IVORY KITCHEN SCALES,2.0,9/5/11 12:41,8.5,12816
565583,22720,SET OF 3 CAKE TINS PANTRY DESIGN,3.0,9/5/11 12:41,4.95,12816
565583,23054,RECYCLED ACAPULCO MAT LAVENDER,2.0,9/5/11 12:41,8.25,12816
565583,23052,RECYCLED ACAPULCO MAT TURQUOISE,2.0,9/5/11 12:41,8.25,12816
565583,22366,DOORMAT AIRMAIL,2.0,9/5/11 12:41,7.95,12816
565583,82484,WOOD BLACK BOARD ANT WHITE FINISH,2.0,9/5/11 12:41,7.95,12816
565583,22176,BLUE OWL SOFT TOY,6.0,9/5/11 12:41,2.95,12816
565583,22494,EMERGENCY FIRST AID TIN,12.0,9/5/11 12:41,1.25,12816
565583,,POSTAGE,1.0,9/5/11 12:41,40.0,12816
573999,22690,DOORMAT HOME SWEET HOME BLUE,2.0,11/2/11 11:43,8.25,12779
573999,23243,SET OF TEA COFFEE SUGAR TINS PANTRY,4.0,11/2/11 11:43,4.95,12779
573999,,TEA TIME OVEN GLOVE,10.0,11/2/11 11:43,1.25,12779
573999,23198,PANTRY MAGNETIC  SHOPPING LIST,12.0,11/2/11 11:43,1.45,12779
573999,22624,IVORY KITCHEN SCALES,4.0,11/2/11 11:43,8.5,12779
573999,22625,RED KITCHEN SCALES,2.0,11/2/11 11:43,8.5,12779
573999,22978,PANTRY ROLLING PIN,6.0,11/2/11 11:43,3.75,12779
573999,37450,CERAMIC CAKE BOWL + HANGING CAKES,18.0,11/2/11 11:43,2.55,12779
573999,85094,CANDY SPOT EGG WARMER RABBIT,48.0,11/2/11 11:43,0.19,12779
573999,23322,LARGE WHITE HEART OF WICKER,6.0,11/2/11 11:43,2.95,12779
573999,23321,SMALL WHITE HEART OF WICKER,12.0,11/2/11 11:43,1.65,12779
573999,22469,HEART OF WICKER SMALL,12.0,11/2/11 11:43,1.65,12779
573999,22470,HEART OF WICKER LARGE,6.0,11/2/11 11:43,2.95,12779
573999,22627,MINT KITCHEN SCALES,2.0,11/2/11 11:43,8.5,12779
573999,22626,BLACK KITCHEN SCALES,2.0,11/2/11 11:43,8.5,12779
573999,23159,SET OF 5 PANCAKE DAY MAGNETS,12.0,11/2/11 11:43,2.08,12779
573999,23154,SET OF 4 JAM JAR MAGNETS,12.0,11/2/11 11:43,2.08,12779
573999,22055,MINI CAKE STAND  HANGING STRAWBERY,8.0,11/2/11 11:43,1.65,12779
573999,22061,LARGE CAKE STAND  HANGING STRAWBERY,2.0,11/2/11 11:43,9.95,12779
573999,22057,CERAMIC PLATE STRAWBERRY DESIGN,12.0,11/2/11 11:43,1.49,12779
573999,22646,CERAMIC STRAWBERRY CAKE MONEY BANK,12.0,11/2/11 11:43,1.45,12779
573999,37447,CERAMIC CAKE DESIGN SPOTTED PLATE,12.0,11/2/11 11:43,1.49,12779
573999,37449,CERAMIC CAKE STAND + HANGING CAKES,2.0,11/2/11 11:43,9.95,12779
573999,,SET OF 4 FAIRY CAKE PLACEMATS,4.0,11/2/11 11:43,3.75,12779
573999,,SET OF 4 ENGLISH ROSE PLACEMATS,4.0,11/2/11 11:43,3.75,12779
573999,22666,RECIPE BOX PANTRY YELLOW DESIGN,12.0,11/2/11 11:43,2.95,12779
573999,22722,SET OF 6 SPICE TINS PANTRY DESIGN,8.0,11/2/11 11:43,3.95,12779
573999,23423,PANTRY 3 HOOK ROLLING PIN HANGER,6.0,11/2/11 11:43,3.75,12779
573999,23113,PANTRY CHOPPING BOARD,3.0,11/2/11 11:43,4.95,12779
573999,21929,JUMBO BAG PINK VINTAGE PAISLEY,10.0,11/2/11 11:43,2.08,12779
573999,21930,JUMBO STORAGE BAG SKULLS,10.0,11/2/11 11:43,2.08,12779
573999,22979,PANTRY WASHING UP BRUSH,12.0,11/2/11 11:43,1.45,12779
573999,20836,FRENCH PAISLEY CUSHION COVER,12.0,11/2/11 11:43,0.83,12779
573999,20839,FRENCH PAISLEY CUSHION COVER,12.0,11/2/11 11:43,0.85,12779
573999,22094,RED RETROSPOT TISSUE BOX,36.0,11/2/11 11:43,0.39,12779
573999,22092,BLUE PAISLEY TISSUE BOX,36.0,11/2/11 11:43,0.39,12779
573999,21824,PAINTED METAL STAR WITH HOLLY BELLS,48.0,11/2/11 11:43,0.39,12779
573999,22065,CHRISTMAS PUDDING TRINKET POT,48.0,11/2/11 11:43,0.39,12779
573999,21232,STRAWBERRY CERAMIC TRINKET POT,24.0,11/2/11 11:43,1.25,12779
573999,22059,CERAMIC STRAWBERRY DESIGN MUG,48.0,11/2/11 11:43,1.25,12779
573999,37448,CERAMIC CAKE DESIGN SPOTTED MUG,48.0,11/2/11 11:43,1.25,12779
573999,22195,LARGE HEART MEASURING SPOONS,12.0,11/2/11 11:43,1.65,12779
573999,22063,CERAMIC BOWL WITH STRAWBERRY DESIGN,12.0,11/2/11 11:43,2.95,12779
573999,22173,METAL 4 HOOK HANGER FRENCH CHATEAU,8.0,11/2/11 11:43,3.29,12779
573999,37446,MINI CAKE STAND WITH HANGING CAKES,8.0,11/2/11 11:43,1.45,12779
574343,20839,FRENCH PAISLEY CUSHION COVER,12.0,11/4/11 10:11,0.85,12576
574343,20836,FRENCH PAISLEY CUSHION COVER,12.0,11/4/11 10:11,0.83,12576
574343,22722,SET OF 6 SPICE TINS PANTRY DESIGN,4.0,11/4/11 10:11,3.95,12576
574343,21770,OPEN CLOSED METAL SIGN,4.0,11/4/11 10:11,4.95,12576
574343,22683,FRENCH BLUE METAL DOOR SIGN 8,10.0,11/4/11 10:11,1.25,12576
574343,,SINGLE HEART ZINC T-LIGHT HOLDER,12.0,11/4/11 10:11,1.25,12576
574343,23144,ZINC T-LIGHT HOLDER STARS SMALL,12.0,11/4/11 10:11,0.83,12576
574343,22469,HEART OF WICKER SMALL,12.0,11/4/11 10:11,1.65,12576
574343,82583,HOT BATHS METAL SIGN,12.0,11/4/11 10:11,2.1,12576
574343,82580,BATHROOM METAL SIGN,12.0,11/4/11 10:11,0.55,12576
574343,23250,VINTAGE RED TRIM ENAMEL BOWL,12.0,11/4/11 10:11,1.25,12576
574343,23249,VINTAGE RED ENAMEL TRIM PLATE,12.0,11/4/11 10:11,1.65,12576
574343,85054,FRENCH ENAMEL POT W LID,6.0,11/4/11 10:11,2.95,12576
574343,85053,FRENCH ENAMEL CANDLEHOLDER,6.0,11/4/11 10:11,2.1,12576
574343,22340,NOEL GARLAND PAINTED ZINC,24.0,11/4/11 10:11,0.39,12576
574343,35953,FOLKART STAR CHRISTMAS DECORATIONS,48.0,11/4/11 10:11,0.39,12576
574343,21261,GREEN GOOSE FEATHER CHRISTMAS TREE,6.0,11/4/11 10:11,2.95,12576
574343,23188,VINTAGE  2 METRE FOLDING RULER,12.0,11/4/11 10:11,1.65,12576
574343,84832,ZINC WILLIE WINKIE  CANDLE STICK,12.0,11/4/11 10:11,0.85,12576
574343,22998,TRAVEL CARD WALLET KEEP CALM,24.0,11/4/11 10:11,0.42,12576
574343,23394,POSTE FRANCE CUSHION COVER,4.0,11/4/11 10:11,3.75,12576
574343,23395,BELLE JARDINIERE CUSHION COVER,4.0,11/4/11 10:11,3.75,12576
574343,23396,LE JARDIN BOTANIQUE CUSHION COVER,4.0,11/4/11 10:11,3.75,12576
574343,23393,HOME SWEET HOME CUSHION COVER,4.0,11/4/11 10:11,3.75,12576
574343,22481,BLACK TEA TOWEL CLASSIC DESIGN,12.0,11/4/11 10:11,1.25,12576
574343,16016,LARGE CHINESE STYLE SCISSOR,10.0,11/4/11 10:11,0.85,12576
,37447,CERAMIC CAKE DESIGN SPOTTED PLATE,-4.0,11/18/11 17:10,1.49,12779
,23423,PANTRY 3 HOOK ROLLING PIN HANGER,-2.0,11/18/11 17:10,3.75,12779
,22666,RECIPE BOX PANTRY YELLOW DESIGN,-2.0,11/18/11 17:10,2.95,12779
